별점(평점),리뷰내용,작성일자,공감횟수,비공감횟수
10,토 나올 것처럼 웃다 옴. 이 영화에서 이토록 다양한 액션을 볼 줄이야.,2019.01.24 21:58,2,0
10,호불호따위없음 핵 꿀잼 영화,2019.01.24 21:57,2,0
10,ㅋ 내내 웃다가 나왔습니다 진짜 ㅋㅋㅋ,2019.01.24 21:53,2,0
10,호불호 걱정마시고 그냥 보고나오세요. 엄청 재밌네요. 아. 또 봐야겠네. 코미디 영화 최고봉 될 듯,2019.01.24 21:52,2,0
10,엄마랑 보고왔는데 정말 처음부터 웃었습니다처음부터 끝까지 다 웃겼습니다ㅋㅋㅋㅋ내일은 친구랑 보러갑니닼ㅋㅋ,2019.01.24 21:51,2,0
10,이런 코미디 정말 오랜만. 쉴틈없이 웃기네요. 평점 처음 남깁니다. 어색한 연기없이 자연스런 연기가 완전 좋아요. ㅋ,2019.01.24 21:51,2,0
10,개꿀잼ㅎㅎ 추천합니다!,2019.01.24 21:44,2,0
10,첨부터 끝까지 계속 웃김,2019.01.24 21:43,2,0
10,존나 개꿀잼 계속웃엇어욬ㅋㅋㅋ,2019.01.24 21:41,2,0
10,시작부터 끝까지 웃김 죽을뻔함 쏴..,2019.01.24 21:39,2,0
10,많이 웃었어요~^^배우들의 각자의 역할을 잘소화했어요~뽱~^^,2019.01.24 21:37,2,0
10,아 정말 간만에 웃겨 죽는줄ㅎㅎ신하균배우도 코믹해요,2019.01.24 21:37,2,0
10,영화보면서 제일 오랫동안 웃었던것 같습니다~소소하게는 셀수도 없이 많고 빵~터지는 웃음은 한 10번정도~코메디로만도 이렇게감동과 재미까지 있다니~한국영화의재발견 입니다^^,2019.01.24 21:36,2,0
10,아니 졸랭 웃기네ㅜㅜ 진짜 아니 절라 웃곀ㅋㅋㅋ왘ㅋㅋㅋ,2019.01.24 21:36,2,0
10,퇴근 후 피로 싸악 마음껏 웃었다!,2019.01.24 21:36,2,0
10,아 진짜 웃다가 뒈지는줄,2019.01.24 21:31,2,0
10,개꿀잼 진짜 리얼 투루♡,2019.01.24 21:31,2,0
10,리얼 웃기네ㅋㅋ감독 뽕영화찍은게아니라 뽕빨고영화찍음,2019.01.24 21:30,2,0
10,"진짜 시작부터 끝까지 계속 웃었고 그만큼 내용도 재밌음! 마약반 5명의 배우분들이 모두 매력넘치고 연기력이 .! 친구들이랑 같이 봤는데 너무 재미있어서 남자친구랑 또 보러가려구요!진선규 배우님 진짜.,. 반했습니다ㅠ...",2019.01.24 21:13,2,0
10,생각보다 재밋게 봣습니다 올해 중 제일 재밋엇음,2019.01.24 21:04,2,0
10,예상대로 흘러갈 줄 알았는데 예상을 깨서 잼있네요 ㅎㅎ 볼 만 합니다,2019.01.24 21:03,2,0
10,오랜만에 cj영화 대박,2019.01.24 20:40,2,0
10,그냥 존나게 웃깁니다... 이병헌 감독 언럭키 타란티노...,2019.01.24 20:40,2,0
10,아무 생각없이 2시간동안 웃고 나오기 좋은 영화스트레스 해소에 직빵 （＾◇＾）,2019.01.24 20:36,2,0
10,일단 기대하지 말고 보세요. 정말 웃깁니다. 전 예고편 보고 너무많이 걱정했는데 예고편장면이 생각나 더 웃었습니다. 참 밝고 치킨이란 소재가 신선하고 재밌습니다. 꼭 보세요. 기분이 맑아지네요.,2019.01.24 20:17,2,0
10,너무 재밌게 봤습니다 이하늬씨 찰진 연기도 돋보였습니다,2019.01.24 20:16,2,0
10,오랜만에 실컷 웃었네요?완전 잼나요~~^^,2019.01.24 19:12,2,0
10,너무 웃겨서 보는 내내 웃었어요ㅋㅋ  끝나고 치킨먹으러~~,2019.01.24 19:07,2,0
10,진짜 재밌어요 꼭 보세요!원래 영화보고 이렇게 평점 같은 거 안남기는 데 이건 너무 재밌어서 보고 난 뒤로 쿠키영상 같은 거 찾아보고 평점 남겨요 ㅋㅋㅋ!!! 어제 봤는데 진짜 한 번 더 보고 싶어요 진심 너무 재밌...,2019.01.24 17:50,2,0
10,코미디도 코미디였는데 생각보다 액션이 훌륭했다 요즘 본 영화 중에 가장 재밌었다 다만 악당보스가 너무 허무함,2019.01.24 17:49,2,0
10,개뻔한데 개FUN합니다.,2019.01.24 17:32,2,0
10,두시간 내내 웃으며 재미있게 봤습니다~~ㅎㅎ,2019.01.24 17:29,2,0
10,영화 보는 내내 웃었습니다ㅋㅋㅋㅋ재밌네요,2019.01.24 17:29,2,0
10,레알 대존잼ㅋㅋㅋㅋ 다들 연기 찰떡이고 오랜만에 깔깔 웃으면서 봤음ㅋㅋ,2019.01.24 17:20,2,0
10,정말 너무 재밌습니다. 배우들 연기력도 좋고 웃음이 멈추질 않습니다. 정말 좋은영화 꼭 추천드립니다 ! 흥미진진한 스토리도 좋다 !,2019.01.24 17:19,2,0
10,웃고 사이다재미보장 빠밤,2019.01.24 17:02,2,0
10,간만에 웃음코드 맞아서 거의 울었습니다,2019.01.24 16:51,2,0
10,겁나 웃김~ 아무생각 없이 웃으실분께 강추!,2019.01.24 16:42,2,0
10,잼나요 옆에 아줌마들 웃는 소리에 웃다가 나옴,2019.01.24 16:37,2,0
10,아 저도 맞는뎈ㅋㅋ롯ㅇ시네마로봐서 어케하는디 모르겟지만 ㅋㅋ암튼 지짜웃겨옄ㅋㅋ다 웃겨 5명ㅋㅋ,2019.01.24 16:36,2,0
10,윤계상에 이어 여친이하늬도 영화 대박나겠네... 코즐잼영화 굿^^,2019.01.24 16:34,2,0
10,재밌재밌어요..뿡쁑,2019.01.24 16:33,2,0
10,진짜 최고!!! 두시간동안정말 배꼽잡으면서봣습니다다섯명의케릭터가 조화가너무좋고 다섯배우들의 조합이 너무좋네여,2019.01.24 15:21,2,0
10,내가 본 범죄오락영화 중에서 제일 재밌는 영화였다!!! 베테랑이랑 마스터보다도 훨씬 재밌는 영화이다 이건!!!,2019.01.24 15:18,2,0
10,배꼽빠지게 웃긴 영화 꼭 보세요,2019.01.24 15:15,2,0
10,보시면 압니다. 단체로 봤는데 10명중 9명이 너무 웃기다고 하네요,2019.01.24 15:11,2,0
10,간만에 제대로 된 코미디 영화인듯 ㅋㅋ 시간순삭에 방심하다 터집니다 ㅋㅋ 광고나온거.뒤로도 많이웃겨요 ㅋㅋㅋㅋ,2019.01.24 15:07,2,0
10,진짜 역대급 영화인듯 국내에선 코믹중 최고,2019.01.24 14:26,2,0
10,대박 완전 재밌어요ㅋㅋㅋㅋ,2019.01.24 13:58,2,0
10,진짜 오랜만에 넘 웃으면서 봤어요 처음부터 끝까지 웃깁니다!!!,2019.01.24 13:58,2,0
10,몇년동안 아니 역대 제일 많이 웃었음 강추,2019.01.24 13:41,2,0
10,지인들에게 추천해줬습니다 유쾌하고 통쾌하게 봤습니다,2019.01.24 13:26,2,0
10,코엑스메가박스에서  더뷰티크 스위트룸에서 3만원 주고봤다..안아깝다. 잘봤다 . 너무웃었다.,2019.01.24 13:16,2,0
10,재밌었어요 연기두 좋았구요,2019.01.24 12:53,2,0
10,고구마전개없어서 좋았어요 가볍게 웃으면서 딱 킬링타임으로 보기좋아요 재밌었습니다!,2019.01.24 12:53,2,0
10,오랜만에 돈아깝지 않는 영화 잘보고 왔습니다.가벼운 마음으로 보시는게 좋을거 같아요ㅎ,2019.01.24 12:49,2,0
10,진짜 오랜만에 재밌게봤어요,2019.01.24 12:44,2,0
10,진짜 처음부터 끝까지 웃김 ㅋㅋㅋ,2019.01.24 10:56,2,0
10,그냥 존나재밋다 걍 걍 재밋음,2019.01.24 10:20,2,0
10,진짜 시간 가는줄 모르고 오랜만에 재밌는 영화 본 것 같아서 기분이 좋아요,2019.01.24 10:19,2,0
10,영화 처음부터 끝까지 웃고만 나옴,2019.01.24 10:12,2,0
10,아 진짜 이영화 미쳤다ㅋㅋ작정하고 웃기려고 드는데..조조로 혼자보러갔어도 소리내서 신나게 웃었다별 50개 주고싶다,2019.01.24 08:23,2,0
10,정말 재밋음. 이런거 안남기는데 넘 재밋게봐서 대박나길기원해서 남김 . 개강추임 예고편은 그냥 누가 찍엇는지 드럽게 못찍어서 . 보면 후회안해요,2019.01.24 08:19,2,0
10,최고  시작과 끝은 웃음으로 작렬,2019.01.24 08:07,2,0
10,솔직한평점!!간만에 웃기고 맛깔나는영화나왔네요가족끼리 연인끼리 혼자봐도 재밌을영화뱅우분들  한분한분다 재밌구 연기도 엄지척이네요강추  솔직한 평점 입니다,2019.01.24 07:20,2,0
10,너무 웃기게 잘 보다 나왔어용,2019.01.24 07:18,2,0
10,엄마아빠 모시고 같이봣어요 ㅋㅋ부모님은 한국영화보다 외국영화 좋아하시는데 엄마가 간만에 웃엇다고 너무 재미잇게 잘봣다고하셧어요 ㅋㅋ진짜 기대안하고 마음편하게봣다가 웃고만 나왓네요 꼭보세요!감독도 누군가햇던 스물 감독...,2019.01.24 07:16,2,0
10,정말재밌고 배우들의연기가 짱이였어요!!,2019.01.24 06:34,2,0
10,졸 웃김 재밌어요 ㅎㅎㅎ,2019.01.24 06:31,2,0
10,진심으로 개꿀잼!! ㅋㅋ,2019.01.24 06:27,2,0
10,한번 더 보고싶을정도로 꿀잼 ㅠㅜㅜㅜ,2019.01.24 06:21,2,0
10,진짜 너무 재미있었어요ㅠㅠ또보고싶네요,2019.01.24 06:09,2,0
10,너무웃어서 난중에는  배가고프던데요~^^,2019.01.24 06:09,2,0
10,오랫만에 볼만한 영화 ㅋㅋ,2019.01.24 04:20,2,0
10,진짜 끝날때까지 웃다가 나왔어요 ㅎㅎㅎ 대박,2019.01.24 04:11,2,0
10,가볍게 보기 좋음 중간에 살짝 루즈한 면도 있지만 배우들 연기 잘해서 볼만함 그와중에 이하늬 이뿌고 난리+.+ 신스틸러 테드창 역시 찌질연기는 오정세씨 따라갈 사람 없음 ㅋㅋㅋㅋ,2019.01.24 01:48,2,0
10,진짜 너무재밌음ㅠㅠ영화 소개해주는 영상들은 새발의 피였어...,2019.01.24 01:37,2,0
10,아 이번에 제대로 터졌닼ㅋㅋ 계속 생각남ㅋ,2019.01.24 01:34,2,0
10,개봉하기만을 손꼽아 기다리다 개봉당일 극장에서 봤습니다.간만에 극장에서 진심으로 웃으면서 나왔습니다ㅋㅋㅋㅋ제대로된 오락영화를 본 느낌,2019.01.24 01:34,2,0
10,첨부터 끝까지 웃김ㅋㅋ진짜 요근래본 본것중에 젤웃겼음,2019.01.24 01:24,2,0
10,오핸만에 영화보면서 웃으면서봤네요 ㅎㅎ 너무너무재밌었습니다,2019.01.24 01:11,2,0
10,오늘 봤는데 재밌어요! 좀비 ㅋㅋㅋㅋ 반장님 진짜 웃깁니다! ㅋㅋㅋㅋ,2019.01.24 01:10,2,0
10,야간마치고 보는데 웃다가 지칠뻔 했네요,2019.01.24 01:10,2,0
10,스트레스풀고즐기는데 최고,2019.01.24 01:04,2,0
10,꼭보세요.후회안할껍니다ㅋㅋ,2019.01.24 01:02,2,0
10,지금껏 잼있는 영화는 없었다ㅎㅎ영화인가? 코메디인가.ㅎㅎㅎ,2019.01.24 01:01,2,0
10,너무재밋어요 ㅋㅋㅋ 계속 웃으면서 봄,2019.01.24 01:00,2,0
10,엄지척!! 최고 잼있음,2019.01.24 00:59,2,0
10,처음부터끝까지웃었어요 재밌게 잘 봤습니당 추천해요^^,2019.01.24 00:59,2,0
10,작년 올래 본거중에 젤 재밋게봄,2019.01.24 00:59,2,0
10,올만에 제대로된 코믹봐요 지루하지않고 즐기면서 봤어요,2019.01.24 00:58,2,0
10,개인적으로 너무나 재밋엇어요,2019.01.24 00:57,2,0
10,존잼ㅋㅋ처음부터 끝까지 웃었다,2019.01.24 00:50,2,0
10,완전 재밌게 봤어요~간만에 유쾌한 영화배우들 케미도 최고,2019.01.24 00:50,2,0
10,난 웃기던데 진짜 막 후반에 이상한 감동코드따위도 없고 첨부터 끝까지 웃기던데,2019.01.24 00:50,2,0
10,오늘 보고 왔는데 진짜 오랫만에 너무 웃기고 재미있는 영화 봤네요 강추,2019.01.24 00:50,2,0
10,구라안치고 감동 슬픔1도없지만 내평생본영화중에 가장웃긴영화였음 ㅋㅋ 이조합 너무좋았다,2019.01.24 00:48,2,0
10,계속웃겨서 배아파죽을뻔했어요 댓글남겨보는건 처음이에요 너무웃겨요 ㅜ 내용은 뻔한내용이긴하지만 20년인생동안 제일 재밌게봤어요 댓글알바면 대학붙은거 자퇴할게요 진짜 개재밌어요,2019.01.24 00:35,2,0
10,웃겨서 눈물난다는게 이런느낌인지 알려준영화입니다 ㅋㅋㅋ진짜 재미있게 잘봤습니다!,2019.01.24 00:29,2,0
10,개인적으로 이동휘씨 광팬인데 제일 잘 웃길 수 있는 배우임에도 불구하고 비중이 적은 느낌ㅠㅠㅠ 하지만 정말 재밌게 봤어요~,2019.01.24 00:26,2,0
10,재밌어요 너무너무너무우우우우,2019.01.24 00:26,2,0
10,대박 완전 강추예여영화 끝나는데 넘나 아쉬웠어여,2019.01.24 00:26,2,0
10,기억에 맴도는코미디영화 당황스럽다.,2019.01.24 00:25,2,0
10,정말 꿀잼으로 봤습니다 감사합니다!,2019.01.24 00:22,2,0
10,진짜 웃다가 배아픈적은,2019.01.24 00:22,2,0
10,근래 영화들이 다 노잼이었어서 진짜 오랜만에 재밌는 영화 본듯,2019.01.24 00:22,2,0
10,진짜후회안함 진짜 계속웃었다,2019.01.24 00:22,2,0
10,뭐야 알고보니 어벤져스,2019.01.24 00:22,2,0
10,시한부인 사람도 웃느라 아무 생각 안할 수 있는 영화,2019.01.24 00:20,2,0
10,지금 보고 들어왔습니다. 색즉시공 이후에 가장 웃긴 한국영화였네요. 장르가 코미디라 쉽지않겠지만 천만 영화 됐으면 좋겠어요. 마음떳 웃었습니다 ^^,2019.01.23 23:48,2,0
10,목이 쉬도록 웃으면서 나온 영화스트레스가 확 날아가네요 !,2019.01.23 23:26,2,0
10,처음부터 끝까지 장르에 충실한 코미디영화는 오랜만이였네요.2시간내내 그냥웃다나옴 간만에 극장에서 만족하고나왔네요.,2019.01.23 23:21,2,0
10,재밌다 류승룡 이제부터 착하게 살아라 ㅋㅋ,2019.01.23 23:20,2,0
10,진짜많이 웃었어요 잼나요~~,2019.01.23 23:14,2,0
10,넘재미있어요~~~~,2019.01.23 23:12,2,0
10,딱 킬링타임으로 좋은영화다 가볍게 보고 나온 느낌,2019.01.23 23:12,2,0
10,류승룡 특유의 연기 간만에 보니 더욱 반갑고 재미났음,2019.01.23 23:10,2,0
10,완전 재밌어요영화 보는 내내 배꼽 빠지는줄ㅋㅋ,2019.01.23 23:09,2,0
10,너무 재미있었어요.끝까지 많이 웃었어요,2019.01.23 23:09,2,0
10,꼭 보세요!!!! 너무 재미있습니다!!!!,2019.01.23 23:08,2,0
10,아무생각없이 즐기기 좋은영화입니다 재밌게잘봤고 뜻밖의액션씬도 좋았습니다,2019.01.23 23:07,2,0
10,"솔직히 염력이후로 불안해하며 간건 사실이다,예고편이 웃겨서 가보았지만 기대이상으로 최근 본 코미디 영화중 가장 많이 웃었고 들 전체가 대부분 많이 웃었던것같다 이하늬 등남배우분들 케미도 좋고 잠깐이나마 힐링한 ...",2019.01.23 23:05,2,0
10,제가 웃음을 잃어버린지 20년이 되었는데 오늘 찾았네요.,2019.01.23 23:04,2,0
10,존잼임 진짜 배꼽 어디갔냐,2019.01.23 23:01,2,0
10,그냥 재밌음 웃기라고 만듦,2019.01.23 22:56,2,0
10,진짜 솔직하게 오늘 봤는데 재밌는거 ㅇㅈ,2019.01.23 22:56,2,0
10,재밌게  봤습니다. 뭐 즐기려고 영화를 보는거라 저라 비슷한 생각에 영화보신다면 최고입니다.,2019.01.23 22:55,2,0
10,하하하하 안아파~-~~~,2019.01.23 22:54,2,0
10,줜나게 재밌습니다 ㅋㅋ 영화보면서 내가 이렇게 웃어본적이있나 싶을정도,2019.01.23 22:53,2,0
10,잼~~~~!!!!@&&@&????,2019.01.23 22:53,2,0
10,정말 오랜만에 재밌는 영화 보았네요.. 강력하게 추천합니다,2019.01.23 22:52,2,0
10,정말 후기 안남기는데 진짜 재밌네요,2019.01.23 22:52,2,0
10,지금보고 왔습니다. 살아난 갓유승룡~ 적어도 700만!!! 안보면 후회 합니다 ^^,2019.01.23 22:52,2,0
10,아 처음으로 혼자가서 소리내면서 웃었네 ㅋㅋ,2019.01.23 22:52,2,0
10,엄청웃깁니다 간만에 스트레스좀 풀었네요 웃으면서,2019.01.23 22:51,2,0
10,간만에 웃으면서 봤어요.. 그냥 생각없이 웃으면서 보기 좋음.,2019.01.23 22:17,2,0
10,마형사 역할 맡은 진선규씨가 대박 웃깁니다,2019.01.23 22:16,2,0
10,개존잼탱이에옄ㅋㅋㅋㅋ,2019.01.23 22:14,2,0
10,너무 재미있게 봤어요 마지막까지 지루하지 않게 넘 재밌게 봤어요,2019.01.23 22:11,2,0
10,웃다가 시간가는줄 몰랐음,2019.01.23 22:11,2,0
10,웃기려고 작정하고 만든 영화인듯 꿀잼!,2019.01.23 22:11,2,0
10,정말 엄청 웃는영홬ㅋ,2019.01.23 22:11,2,0
10,(나즈막히) 쏴....,2019.01.23 22:11,2,0
10,심오한 영화도 좋지만 이런 영화도 좋닼ㅋㅋ 웃길려고 작정했네요 꼭보세요!!!,2019.01.23 22:09,2,0
10,지금까지 이런맛은없었다. 이것은 갈비인가 통닭인가오늘 일하다말고 미리예매한 보람이있네요 꿀잼입니다!,2019.01.23 21:15,2,0
10,큰 기대없이 봤는데 박수치고 소리내면서 웃다 나왔습니다 ㅋㅋㅋㅋ 진선규님을 비롯해서 캐릭터 하나하나 다양하고 재밌어요 ㅎㅎㅎ 적어도 500만은 넘기지 않을까싶네요,2019.01.23 21:14,2,0
10,생각보다 너무 재미있었어요.제가 영화관에서 영화를 보고있다는 것도 까먹을만큼 재미있었네요!특히 진선규 배우님 연기 너무 잘해요 ㅠㅠ 넘 웃겨요!!처음부터 끝까지 재밌습니당!!,2019.01.23 21:13,2,0
10,입대전날에 기대되서 봤는데 시간안아깝게 정말 재밌었어요 진짜 후회안합니다 ㅜㅜㅜ 꼭 추천!,2019.01.23 21:12,2,0
10,웃겨요 웃겨 ㅋㅋㅋ 즐겁게 보고 나왔습니다,2019.01.23 21:11,2,0
10,영화 리뷰어들한테 스포 당한거 같아서 안 볼까 했는데 예고는 진짜 빙산의 일각임.걍 웃길라고 작정하고 만든 영화인데 개웃김 ㅋㅋ 걍 아무 생각 없이 웃고 싶으신 분들 꼭 보세요.완벽한 타인들 이후로 영화관에서 개 웃...,2019.01.23 20:57,2,0
10,재미있읍니다~~~~위트와 풍자도 매력적이네요시간 가는줄 모르고 봤읍니다,2019.01.23 20:54,2,0
10,이렇게 통쾌한 결말은 오랜만에 본 것 같습니다! 무적의 마약반!ㅋㅋㅋㅋ 스토리에 치킨장사 넣으신거 신의 한수...짝짝짝ㅋㅋㅋㅋ 환장하는 팀워크에서 환상의 팀워크를 보여준 마약반형사들!  촬영현장이 얼마나 화목했는지 ...,2019.01.23 20:53,2,0
10,부모님 보여드렸는데 재밌었다고 하시네요,2019.01.23 20:50,2,0
10,진짜 예고편이 다일까봐 걱정했는데 아니에요 ㅠㅠㅠ,2019.01.23 20:48,2,0
10,엄청 웃었습니다 완벽한타인 이후로 재밌어요,2019.01.23 20:47,2,0
10,"간만에 영화관에서 진심으로 웃어본 것 같다. 코미디 답게 웃음은 당연히 최고, 액션도 웬만한 액션 영화는 애들 장난으로 보일 정도로 완벽하며 통쾌하다. 스토리와 연출, 배우들의 연기까지 정말 모든 게 완벽했던 최고의...",2019.01.23 20:41,2,0
10,"최근에 봤던 영화 중에 하나도 돈 안 아까웠고, 아무생각없이 봤는데 계속 웃었던 영화네요 ㅋㅋㅋㅋ 최고!",2019.01.23 20:40,2,0
10,각자 캐릭터도 웃기도 내용도 웃겨요,2019.01.23 20:39,2,0
10,영화보는내내 웃느라 극한직업,2019.01.23 20:37,2,0
10,진짜 너무 재밌어요 ㅜㅜ,2019.01.23 20:36,2,0
10,진짜 계속 웃으면서 봤어요 너무 재밌더라구요 ㅎㅎ,2019.01.23 20:35,2,0
10,경찰인남자친구랑 함께봤는대 현실성이좀떨어지긴하지만 영화너뮤재밌었어요! 후반부 액션들도그렇고 진선규씨 너무멋있었습니다!!,2019.01.23 20:33,2,0
10,B급 감성이 없는 분들에게는 재미없겠지만 B급 감성이 충만한 분들에게는 재밌게 즐길수 있는 영화라고 생각됨,2020.03.31 19:27,3,1
10,재밌고 연기도 좋았던영화 1점테러 댓글알바들이악물고 1점주는모습도 상상하면웃김,2019.10.09 13:15,3,1
10,부모님이랑 매우 재밌게봄,2019.07.01 15:12,3,1
10,계속 웃을 정도로 너무 재밌게 봤네요,2019.06.14 16:59,3,1
10,재미있어요. 범죄영화같은데 잔인하지않고 치킨이랑 엮어서 이런스토리를 만들어내다니. 신선하고좋네요.,2019.04.28 08:54,3,1
10,모든 배우분들 고생 하셨어요,2019.04.27 19:27,3,1
10,평점 보니까 결국 웃음 코드가 맞냐 안맞냐 차이인 것 같은데 신랑이랑 나랑은 보는 내내 계속 터짐 간만에 재밌는 영화 봐서 좋았다 스토리가 뻔하건 뭐건 배우들 연기부터 대사 하나 하나 주옥같았(? ? ?)! 또 봐도...,2019.03.13 04:26,3,1
10,진짜 한국영화가 이렇게 발전한줄 몰랐습니다,2019.03.09 20:11,3,1
10,정말 재밌게 받습니다 ㅎㅎ,2019.03.09 20:01,3,1
10,생각없이 막 웃을 수 있어 좋았어요,2019.03.09 19:31,3,1
10,가족과 가볍게 보기 좋은 영화!!,2019.03.09 19:29,3,1
10,역쉬 잼나게 잘봤습니다! 늦게보긴했지만 그래도 잼있었어요,2019.03.09 19:23,3,1
10,요즘 뜻대로 되는 일 없어 늘 어두웠는데 활짝 웃었습니다기분전환이 제대로 된 듯~~~,2019.03.09 12:26,3,1
10,큰 기대없이 보면 진짜 웃기고 재밌음,2019.03.09 12:23,3,1
10,잼써용 진선규님 연기 잘하셔요,2019.03.06 00:11,3,1
10,너무웃겼다 배우들 연기도 찰지고 오랜만에 가볍고 재밌게봤다!! 그리고 개그코드가 뭔가 웹툰 질풍기획이 생각난다ㅋㅋㅋㅋ,2019.02.28 19:56,3,1
10,영화 상영시간내내 웃을수 있는 영화!~!!,2019.02.27 10:00,3,1
10,재밌어요 개그가 빵빵터지네요,2019.02.27 00:07,3,1
10,명대사가 나온 이유를 알겠네요. 재미있었습니다.,2019.02.26 23:25,3,1
10,진짜 ㅈㄴ 웃김  계속웃으면서 봄 류승룡 좀비설 ㅋㅋㄱ,2019.02.26 23:02,3,1
10,보는내내 웃음이 끊이지 않는 영화에요^^ 스트레스 풀기에 딱!!,2019.02.26 22:22,3,1
10,별 생각없이봤는데 내내 유쾌함,2019.02.26 22:17,3,1
10,실컷 웃고 왔어요~^^오랜만에 코미디영화보니 좋네요,2019.02.19 13:39,3,1
10,가족들과 보기 좋은 영화,2019.02.19 13:38,3,1
10,아..오늘 봤는데 수원왕갈비통닭 꼭 먹어보고 싶네요!,2019.02.19 13:11,3,1
10,부모님이 원래 영화관에서 잘 주무시는 스타일인데극한직업은 끝까지 주무시지 않고 재밌게 잘 보셨어요 물론 저도 재밌게 봤습니다,2019.02.19 13:07,3,1
10,코믹과 잘 짜여진 이야기 또 왕의남자이후 극장에서 또 보고싶은 영화 잘 만드셨네요....   극한직업 화이팅!!!!,2019.02.19 09:22,3,1
10,ㅋㅋ진짜 재미있어요ㅋㅋ류승룡 얼굴만봐도 웃겨요ㅋㅋㅋㅋ,2019.02.19 09:00,3,1
10,그냥 아무 생각없이 잘 봤다. 지루한 부분도 없었고 다들 연기 웃기게 잘샜다.,2019.02.19 08:49,3,1
10,웃다 배꼽빠질뻔 너무 재미있게 잘 봤어요,2019.02.19 08:19,3,1
10,역대급 코미디 진짜 처음부터 끝까지 내용전개며 대사 애드리브 모두 최고 평점 수준 완벽에 가까운 영화 우리나라 영화사의 한 획을 그었다,2019.02.19 01:42,3,1
10,첨부터 끝까지 루즈함 전혀없고 기분좋은 웃음만 나왔다.정말 재밌게 잘 만든영화!!!,2019.02.19 00:49,3,1
10,촘촘하고 짜임새 있는 스토리로 진짜웃음을 웃게 하는 영화. 감독의 완벽한 배우캐스팅에 박수. 웰메이드란 이런것.,2019.02.19 00:46,3,1
10,그냥 쭉 재미있었음 상상이상의 재미,2019.02.18 21:36,3,1
10,보는 내내 재밌었어요~,2019.02.18 20:15,3,1
10,두번째봤어요^^너무잼있어요,2019.02.18 16:39,3,1
10,한국 코미디 영화중 젤 재밌네요,2019.02.18 12:51,3,1
10,너무 재미있어요.최고,2019.02.18 12:47,3,1
10,역대 영화 흥행순위 2위네 ㄷㄷ,2019.02.18 11:21,3,1
10,한국 코미디 영화에 필수요소인 억지감동을 빼놓은 것만으로도 10점이다,2019.02.15 21:24,3,1
10,처음부터 빵 터짐 넘재미있어요^^,2019.02.15 20:07,3,1
10,코미디 장르의 한 획을 그을 영화다,2019.02.15 12:19,3,1
10,완전잼씀 오랜만에 재미있는영화봤어요,2019.02.15 12:09,3,1
10,진짜 처음으로 아무 생각없이 웃고 스트레스 풀 수 ㅆ어서 좋았아요 이런게 코미디가 아닐까 싶네오,2019.02.15 11:58,3,1
10,보는 내내 웃었다. 연기 진짜 잘하던데?!,2019.02.15 11:41,3,1
10,그냥 별 생각없이 웃다가 나오고 싶으시다면 강추.,2019.02.15 08:46,3,1
10,"역대급 코믹, 지금까지 이런 영화는 없었다.ㅋㅋ",2019.02.15 08:42,3,1
10,졸라웃겻습니다 간만에 재밋는영화,2019.02.15 08:16,3,1
10,"웃긴 것도 있지만, 액션씬이 너무 멋있었음. 마약반 5명 캐미는 말할 것도 없고ㅋㅋㅋㅋ 한번 더 보러 갈 의향 100%",2019.02.15 05:52,3,1
10,영화 보는 3분 내내 웃었던 최고의 코미디 영화 !!,2019.02.15 04:26,3,1
10,겁나웃겨 ㅋㅋㅋ지금까지 이런영화는 없었다ㅋㅋㅋ,2019.02.15 03:58,3,1
10,정말 역사상 국내 코믹영화의 끝이다~!!!,2019.02.14 21:07,3,1
10,올만에 빵 터진 영화 ㅎㅎㅎ,2019.02.14 20:14,3,1
10,잼있어요!!꿀잼! 꼭보세용,2019.02.13 14:02,3,1
10,즐겁고 재밌게 본 걸로 충분히 10점 줄 수 있었어요? 잘 봤습니다~~~,2019.02.13 13:57,3,1
10,간만에 너무 재미있는 한국 코미디 영화 봤네요! 정말 재밌습니다!,2019.02.13 13:09,3,1
10,하 OO 존잼 근데 영화를 7만원주고 봤다 평택 소사 cgv  역시 시골 스럽다 상영관은 많은데 주차장이 ㅈㄴ 협소하다 주말이라 안심했는데 역시다 평택시청...돈모으는법을 안다 서론이 길었다 존잼이나 어제 피같은 딱...,2019.02.12 20:21,3,1
10,"시종 웃음을 주었습니다유승룡. 이하늬, 등 배우들의 연기도 좋았고마약수사대의 극한환경도 이해할수 있었습니다.즐거웠습니다.감나합니다.",2019.02.12 14:31,3,1
10,굿굿입니다굿굿굿굿굯굿,2019.02.12 14:26,3,1
10,간만에 정말 실컷 웃으면서 본 영화! 최고였음 ㅋㅋ,2019.02.12 14:18,3,1
10,인생영화 하나 더 생겼네요. 할인 받는게 안되서 2명이서 원래 값 주고 보는거 아까워했는데 영화 끝나고 나오면서 하나도 안 아까웠다고 얘기하면서 나올정도로 되게 재밌고 후회없는 영화였어요. 배우분들 욕하는 것도 찰지...,2019.02.11 16:29,3,1
