별점(평점),리뷰내용,작성일자,공감횟수,비공감횟수
2,오늘 같이 영화본 사람들은 별로 안웃음.나도 안웃음. 리얼리티 거의없이 코미디하듯 연기해서 별로임. 류승룡은 내아내의 모든것이나 광해에서의 연기가 훨씬 자연스럽고 재밌음.,2019.02.09 18:12,2,2
2,설날 가족끼리 보러갔다 망친영화 재미없는농담에 욕은 왜이리 많은지 ㅂ ㅠㅇ신 단어 왜이리많이나와 영화제목을 극한OO이라고 지어라,2019.02.05 23:06,2,2
2,"자다 나왔다코미디면 코미디고,영화면 영화로 해야지.",2019.02.03 21:10,2,2
2,정말 노잼 개콘보는줄..돈아까워 어쩔수없이 다봄 뺑반 볼껄ㅜㅜ,2019.02.03 21:09,2,2
2,중반까지는 그나마 볼만함  무료관람용,2019.02.03 00:01,2,2
2,너무  뻔해서  지루했어요,2019.01.30 22:50,2,2
2,딘짜 노잼이에요 스토리텔링이 1도 없음 ..그냥 허무하고 기운빠짐. 특히 버스치여서 잡는거 뭔디,2019.01.23 19:28,2,2
2,별 한개도 아까운 영화저한테는 진심 언제 끝나지 끝날 시간만기다린 영화네요,2019.03.16 18:36,3,3
2,1분마다  73번을 웃었다는데언제 어디서 웃어야 되는지?이런 쓰레기 영화를 1600만이 봤다니대사 절반이 욕이고 내용도 20년전 봉숭아 학당 수준이병헌 감독 영화 스물 바람바람바람이 성수기였네이 후론 개점휴업,2019.03.13 22:22,3,3
2,"너무 재미 없어서 영화보는 중간에 나옴,,차라리 증인이 낫더라.",2019.03.13 18:38,3,3
2,감독이 돈 받고 치킨 광고 찍엇나? 의심이 될 정도로 치킨이 너무 많이 나와요. 완마...ㅋㅋ 그리고 배우들이 짱짱하고 평점도 높아서 기대하고 봤는데... 아휴... 극한 직업 영화 보느라 극한 관객 했네요;;;;예...,2019.02.28 21:13,3,3
2,재밌는지 모르겠음 영화에서 닭냄새난다,2019.02.24 20:45,3,3
2,너어어무 재미 없음...,2019.02.09 22:28,3,3
2,TV라디오 스타가 100배는 웃깁니다,2019.02.09 13:33,3,3
2,재미잇다길래 봣는데 모르겟다...난?,2019.02.08 13:04,3,3
2,웃음코드안맞음 돈아까워,2019.02.06 18:51,3,3
2,너무  유치해서 정말...,2019.02.06 18:11,3,3
2,댓글을 끝까지 봤어야 했는데 평론가들도 못믿겠구나,2019.02.04 22:27,3,3
2,OOO기 영화. 진심 핵개쓰.,2019.02.04 18:55,3,3
2,상업영화의 진수를 보여주는 영화... 상영관만 ㅈㄴ게 독점차지하고 내용은 밋밋하고 웃기지도 않는데 억지 웃음 자아나게 만드는 B급 영화...,2019.02.04 11:53,3,3
2,완젼 기대하고 봤는데.. 전 정말 별루~ 내용너무 초반부터 너무너무 산만하고 집중안되는 형사전개에.. 그리고 하.. 이하늬 왤케 연기 허세에 쩔어보이죠?.. 같은 여잔데도 보는내내 허세에 쩐연기에 오글거려서 민망했어...,2019.02.03 21:09,3,3
2,솔직히 역시한국코미디영화의 한계....이걸 못피하다니..,2019.02.03 01:18,3,3
2,노잼;;; 시간때우기용,2019.02.03 01:00,3,3
2,"갓직히 오늘 보고 솔직후기. 류승룡,이동휘,신하균 빼고 나머지 연기력 개똥같아서 집중하기 힘들고 스토리도 너무 질질끌고 뭔가 웃기려고 노력하는데 공감이 안되서 웃어지질 않음. 뭐가 재밌는지 모르겠고 돈이 아깝더라.....",2019.02.01 23:34,3,3
2,하도 재밌다길래 보니 별로. 완벽한 타인이 백배는 재밌다,2019.02.01 10:07,3,3
2,노잼노잼.... ㅠㅠㅠㅠ,2019.01.30 22:55,3,3
2,왠만하면 진짜 글 안남기는데 평점보고  봤는데 진짜 재미 드럽게 없습니다. 억지로 한번 웃어보려해도 억지 웃음유발하는것 때문에 웃음나오지 않습니다.이거 대체 평점 왜이래요??,2019.01.30 22:33,3,3
2,"스포일러가 포함된 감상평입니다. 감상평 보기

														
															
															
																계집년이 사내한테 야 OOO끼라는 대사가 남발되고 사내 따귀를 때리는게 그렇게 보기 좋고 웃기더냐. 쓰레기 똥통나라 쓰레기 영화. 저열한 인종집단",2020.08.16 00:34,4,4
2,??? 뭐가 잼있다는 건지..,2019.07.03 00:31,4,4
2,예고를 봐서 그런지 생각보다 안 웃겼다. 그리고 치킨 가맹점을 이용해 마약배달을 하는건 미드 브레이킹배드를 떠올라게 했다.,2019.03.14 19:03,4,4
2,솔직히 난 그닥이던에 이 영화가 왜 천만 영화인지.,2019.03.06 21:22,4,4
2,아니 장난하나 대한민국사람들이 이렇게 유치한데서 빵터지는줄몰랐네  엄청 뻔한스토리에 그냥 치고박고싸우고 치킨도 누구하나가우연히 맛잇게하는소스 발견해서그게대박터지고 진찐진부한데.. 수준알만하다 완벽한타인이훨씬남,2019.02.10 11:37,4,4
2,호불호 진짜 많이 갈림....,2019.02.05 20:32,4,4
2,진부하다 ... 너무 진부하다 .. 진선규배우가 겨우 2점 채운 영화 1점도 아깝다,2019.02.05 18:38,4,4
2,쓰렉기영화 보고 얘기하는거임,2019.02.05 02:41,4,4
2,웃음코드로 판단되네요. 유치하네요.,2019.02.03 17:23,4,4
2,이걸 못피했네ㅋㅎㅡ.,2019.02.03 10:48,4,4
2,리뷰 보고 봣는데 넘 실망. 억지로 웃어야하나 싶어서 영화가끝나고 넘 피곤햇음 ㅠ공명뜬금없이 웃기는거빼곤 머;;;;딱히,2019.02.02 06:18,4,4
2,개그코드가 안맞는지 한번도 안웃음 심지어 영화 중간에 나온적처음.... 이 영화를 본 관객이 극한직업인 수준,2019.01.30 23:12,4,4
2,존나 재밌어요 무조건 강추합니다,2019.01.28 00:59,4,4
2,호불호가 극명히 나뉠것 같아요.저는 솔직히 노잼이던데...마지막 액션신만 조금 재미있고 나머지는 억지 웃음...쓸데없이 욕을 많이해서 별루였어요,2019.01.26 12:04,4,4
2,유치해..유치최강..비추,2019.01.26 11:38,4,4
2,딱 개그콘서트 같았어요웃긴상황에 대사를 하는 개콘도 전성기때 시청률 30%를 넘었으니비하는 아니라고 생각합니다. 저는 돈/시간둘다 아깝다고 여겨서 2점 드립니다,2019.04.23 18:14,5,5
2,배우들은 이걸 왜 찍겠다고 한걸까....,2019.04.20 11:15,5,5
2,9점은 진짜 아닌듯.. 신하균이랑 류승룡 빼고는 다들 너무 오바연기해서 보기 불편. 이하늬는 욕하는 연습좀 더 했으면 ㅋ 그리고 감독님. 굳이 이하늬 마지막 키스신 넣어야했습니까ㅡㅡ.. 영화관 사람들 다 표정 구렸음...,2019.02.25 14:41,5,5
2,와... 어디서 웃어야하나요?,2019.02.09 09:29,5,5
2,욕+폭력 내용 무 9점 뭐냐,2019.02.08 23:22,5,5
2,기냥 유치한 말장난만 두시간 동안 보고 온 느낌 ㅠㅠ,2019.02.07 14:44,5,5
2,같이 간 사람들은 다 재밌었다고 하는데 아쉽게도 내 웃음코드와는 안맞네 ㅜ,2019.02.06 22:28,5,5
2,평점에 속은 영화.영화를 보는 내내 시종일관 무표정.,2019.02.05 13:33,5,5
2,이 영화가 웃기다 하는 사람들은 수준이 낮은 사람들이 대부분,2019.02.04 19:30,5,5
2,개노잼에다 억지 웃음 스토리도 구려,2019.02.04 15:56,5,5
2,유치한 얕은 개그의 무한 반복으로 피로감이 계속 쌓이는 삼류코메디 영화,2019.02.03 12:57,5,5
2,음 너무기대해서그런가 그냥그랬다 이하늬의섹시함이 너무없어서 보는 내내짜증났다ㅜ,2019.02.02 11:57,5,5
2,알바가 엄청 많은가보내 겁나 잼 없던대,2019.01.30 23:27,5,5
2,"제대로 빈집털이중. 이딴 영화가 스크린 1700, 1900이라니. 얼마나 영화가 없으면",2019.01.27 00:34,5,5
2,Ebs극한직업이 더잼있다,2019.01.26 13:40,5,5
2,내안의그놈보구 기대하구봤다가 실망함 노잼,2019.01.26 10:24,5,5
2,시기를 잘 탄 거품 영화. 연기는 좋았으나 연출과 스토리 모두 뻔해서 흥미롭지 않았던 C급 코미디. 억지도 있어서 오글거리기만 했던 흥행이 이해가 안가는 영화. 다른 작품성 있는 한국영화들도 많은데 이런 영화가 천만...,2020.09.12 21:26,6,6
2,아니.진짜 이게 1600만짜리라니..ㄱ개 노잼이네.,2019.03.27 17:09,6,6
2,왜케연기들이 어색한건데,2019.03.16 00:35,6,6
2,OO 개뽀록 영화다 ㅡ...ㅡ100만관객 만되도 머 대박인데 천만이라 ㅡ...ㅡ 시기에외국 대박영화가 없다는거 글고 대박 작품이 안나왔다는거 웃을 일이 그만큼 헬조선에서 없다는거 지금 세상은  ㅠ..ㅜ,2019.02.22 07:55,6,6
2,별1개도 아깝다.이걸 영화라고  만들었냐?,2019.02.14 17:25,6,6
2,억지로 웃기려는 듯 ; 코드가 맞아야하나부다,2019.02.10 20:37,6,6
2,개그콘서트 수준의 영화가 1000만?스스로 반성하는 계기가되길~~~,2019.02.06 19:39,6,6
2,진짜 이게 웃긴가.... 억지 웃음... 공짜로 봐서 다행..,2019.02.05 19:24,6,6
2,아니 ㅅㅂ 진짜 재밌다고 이게? 아 개어이없네 진짜,2019.02.05 18:12,6,6
2,평점보고 갔는데 너무 재미없어요. 웃기지도 않구요. 실망했습니다.,2019.02.05 17:20,6,6
2,쓰레기같은 영화에요 티켓값이 아깝네요ㅠㅠ,2019.02.03 15:35,6,6
2,알바님들 대체 얼마 버십니까.. 난 너무 별로던데 진심....,2019.01.30 21:56,6,6
2,"진짜 이 영화를 보려는 모든사람을 말리고 싶네요 줄거리도 너무 뻔하고 억지로 웃기려는 의도가 그냥 보여요,, 배우들이 연기를 잘하긴 하지만 그럼에도 이 영화를 살릴 수 없을 만큼 스토리가 별로입니다 두시간 내내 싸우...",2019.01.24 03:14,6,6
2,Tv에서  그냥 해줘도  안볼듯한 영화,2019.02.18 22:46,7,7
2,와... 유치해서  말이안나오더라... 베테랑 황해 범죄도시 정도가a급영화면  이영화는c급이야..,2019.02.09 12:45,7,7
2,미안하다..난 아니었다..특히 영화내내 욕지거리..2000년대 영화맞나 싶었음..,2019.02.07 23:51,7,7
2,감동 여운 없고 웃기려고 개드립만 치는 영화 보는 내내 짜증,2019.02.07 00:44,7,7
2,유트브 및 영화소개가 엑기스 극장에서 볼 영화는 아니다,2019.02.06 20:38,7,7
2,재미없다  억지웃음  저질영화,2019.02.04 00:49,7,7
2,기대했는데 실망했음 거품,2019.02.03 11:26,7,7
2,이거보다가 배꼽빠질뻔했다구요?ㅋㅋㅋ영화보다 댓글이 더웃김ㅋ 그냥 전형적인 한국3류코미디영화,2019.01.30 09:40,7,7
2,재미없음요 알바들 적당히 하시길,2019.01.30 00:55,7,7
2,아...댓글에 속았네...ㅠㅠ,2019.01.28 16:41,7,7
2,아니 진짜로 우리가족만 재미없었던건가 댓글이 알바인가 알수가 없네.... 억지웃음짜내려고 애는 쓰는데 피식한번이나 겨우했네. 호식이,2019.01.24 03:21,7,7
2,예고편 = 내용 출발 비디오여행 하나 보고오면 영화 다 본거,2019.01.24 01:25,7,7
2,"그렇게 재밌진 않아요 소재는 재밌음 아니 근데 이게 왜 4D에서 상영하는지 ,,,? CJ빨인가ㅋㅋ ㅋㅋ",2019.01.23 13:34,7,7
2,공정하게 승부보십쇼 테러수준으로 상영시간으로 승부보시지마시고요. 너무한거아닌가요?,2019.01.23 13:27,7,7
2,별을1개라도준건 배우들섭외때문이고.영화는 별점을줄수가없다.어이가없고 억지스러운영화이며.베테랑과범죄의도시 각본을심하게따라한듯싶으나코믹을억지로쓴시나리오.오랜만에 돈아깝다생각한영화. 1300만은상영운발인듯싶다.예고편의내용...,2019.02.12 14:33,8,8
2,억지로 쥐어짜는 개그에 민망함은 관객의 몫 입니다. 안 웃기구요.. 아줌마들 웃음소리 밖에 안들렸어요. 그래도 뺑반 보단 나은거 같아 2점 드릴게요. 제일 좋은건 둘 다 보지 마세요,2019.02.08 23:57,8,8
2,방금 보고 왔는데 대체 이게 왜 천만인지 이해가 안된다.. 말투는 죄다 오버에 욕하는건 겉돌고 개연성 제로에. 천만이면 어느정도는 될줄알고 그냥 본게잘못...,2019.02.07 12:16,8,8
2,억지웃음강요로 불편하고 지루했던 영화.,2019.02.06 22:06,8,8
2,"극한체험입니다. 천만돌파 될거란 말만 듣고 리뷰 제대로 보지도 않고 본게 후회됩니다. 영화 여태 본것중 가장 재미없습니다. 영화도중 나온건 처음이고, 댓글다는것도 처음입니다. 절대 보지마세요. 최악입니다. 알바들이 ...",2019.02.06 18:55,8,8
2,"나만 노잼이었나,,,",2019.02.01 14:45,8,8
2,"웃겨서 2점, 과대보장  점수에 대한 반감으로 2점",2019.02.01 06:07,8,8
2,완벽한타인보고 한국코메디도 재밌어지는구너 해서 봤는데 극한직업은 진심으로 뭐가 재미있는지 모르겠다...1도 웃은적이 없음 코메디는 웃겨야되는데 B급 코메디도 안되는거 같은데 관객 수는 왜이리 많지...나랑 코드가 안...,2019.02.14 18:10,9,9
2,"이게 1200만이라고? 오늘 영화보러 가서 중간에 나갈뻔 했다. 그동안 1000만 넘은 영화들이랑 급이 너무 틀리네;; 아 이딴 삼류 코미디  영화가 1000만 넘었다는거에 짜증이 다 나네, 암살 베테랑 이런급 보다...",2019.02.10 19:12,9,9
2,큰기대하고 봤다가 어디서 그렇게 웃다가왔다는건지.끝부분조금 웃다가 나왔네요ㅠ,2019.02.08 02:17,9,9
2,평점에 사기당한기분 천만넘을 영화는아님,2019.02.06 20:52,9,9
2,대체 뭐가 재밌는지 모르겠다  웃길려고 그냥 애쓰는거가틈,2019.02.05 18:04,9,9
2,돈아깝더라 억지웃음 유발.. 진짜 알바들 어지간히들 있는듯,2019.01.28 02:35,9,9
2,저질 코메디영화유머1번지수준의 옛날 코메디,2019.01.27 11:28,9,9
2,"저만,,, 개그 코드가 안맞는건가요??",2019.01.24 17:20,9,9
2,코메디 영환데 도대체 어디서 웃어야되고 해야될지 모르겟음 그냥 억지로 끼워 맞춘 느낌이다 평점보면 한국 사람들 진짜 나쁜게 너도 당해봐라 이 심보인가? 살다살다 영화보고 열받아서 관람평 쓰기는 처음이네,2019.01.27 00:42,10,10
2,솔직히 1600만 영화는 아니다..  그냥 킬링타임 내가 이영화 본건지 기억도 못하고있었다,2019.07.21 23:12,11,11
2,진정한 극한직업은 이 영화를 본 저와 여러분입니다,2019.01.25 17:44,11,11
2,천만영화? 진짜? ㅜㅜ,2019.02.07 02:38,12,12
2,쟤미없음 어지웃음임 ‥,2019.01.30 22:25,0,1
2,그냥 웃기려고 환장한듯한 오바연기…디테일 허술..,2021.12.31 21:36,1,2
2,관객수 1600만과 매우 높은 점수대는 이해안가지만 그래도 가볍게 즐기기는 무난했다. 그리고 다시 한 번 진선규 팬이 되었다!!! 하드캐리했음,2019.03.16 11:24,1,2
2,나만 재미가 없었나.. 나도 진짜 재밌게 보려고 간건데ㅠ 왜 난 하나도 안웃겼지.. 진선규 배우님 부분이 그나마 좀 재밌었고ㅜ 흐헝,2019.02.28 01:35,1,2
2,재미없어요..어르신들만 웃고... ㅎㅎ 그냥 시간때우는용 딱 그정도,2019.02.27 19:34,1,2
2,예상가능한 웃음포인트 ㅎㅎ,2019.02.09 18:44,1,2
2,아주 재미있게. 보았어요.친구들에게. 적극  추쩐. 하겠습니다,2019.03.17 21:39,2,3
2,내 취향은 전혀 아니였네요 ㅠ 억지웃음..,2019.03.16 17:09,2,3
2,억지웃음 코드 웃길려고 노력은 하는데 웃겨지지도 않고 그냥 좀 지루했어요,2019.02.27 18:32,2,3
2,별하나도 아까운 정말 유치하기 짝이 없내요,2019.02.04 11:41,2,3
2,소문에 간만에 속은 영화국가대표이후 제대로 낚였다쓸데없는 욕 난무,2019.01.26 22:19,2,3
2,진부하고 재미없다 ㄹㅇ,2019.04.27 18:02,3,4
2,너무 기대가 컸다..후,2019.03.13 05:54,3,4
2,코메디가 유치하고 뻔한거지 라고 말하는 사람들은 독창적이고 잘만든 코메디 영화좀 보고 와서 말해라.  특히 류승룡은 이상하게 닭살 돋게 하는 힘이 있다. 황정민은 연기가 깔끔한데...,2019.02.23 11:26,3,4
2,뭐가 재미있는지 모르겠음 억지웃음,2019.02.09 14:26,3,4
2,정말 유치하고 재미 열나게 없어요.,2019.02.06 10:14,3,4
2,한번도 안웃었다.. 억지로 웃길려는듯...,2019.02.03 01:03,3,4
2,재밌다고 해서 봤는데내용도 하나도 없고ㅜㅜ뭐가 재미있는지처음부터 웃기기에만 전념한 영화노잼~~2시간 낭비한 시간이 아까워요,2019.02.02 23:58,3,4
2,잘 모르겠다.... 안웃겼음ㅠㅠ,2019.02.02 21:08,3,4
2,어처구니없구 재미도없는..다 알바들인지 의심스러움,2019.01.30 22:12,3,4
2,지루함ㅠㅠ평 좋아서 웃을 준비하고보았는데ㅠㅜ완전 지루하고가끔씩 웃음 포인트ㅠㅠ,2019.01.26 22:57,3,4
2,1점짜리는 아니다 헌데 거품이 심해 1점드림유치하다 개연성 제로,2019.01.26 12:06,3,4
2,에휴 노잼ㅠㅠ돈아깝네,2019.01.25 22:32,3,4
2,저예산 억지 코미디 영화~^^,2021.01.07 05:35,4,5
2,이 영화보고 인생 배웠습니다 아.. 운이 중요하구나내가 실력이 좀 부족해도 운만 좋으면 대박날수있구나,2020.09.16 01:59,4,5
2,한국식 3류 저예산 코미디영화 . 베테랑을 오마주한 독립영화 느낌. 짜여진 대본 냄새가 너무 강한 개그코드. 극혐.  재미있는 영화가 하도 없고 유행어때문에 입소문 타고 뜬듯...,2019.03.02 21:47,4,5
2,유치했어요 스토리는 볼만했어요,2019.02.10 17:22,4,5
2,별점 현실화를 위해 두개 드립니다.솔직히 10점 만점에 8점 정도가 맞는것 같아요.재밌었지만 9점 넘는건 정말 아닌것 같네요.그냥 피식피식하는 정도입니다.박장대소는 거의 없어요.,2019.02.09 16:33,4,5
2,저는 잘 모르겠더라고요 다른 사람들은 웃는데 웃음코드가 저랑 안맞았음 ㅜ 그냥 치킨 맛있겠다가 끝임,2019.02.06 17:31,4,5
2,알리타보다 평점 높은게 이해x,2019.02.06 09:37,4,5
2,이거 보는게 말 그대로 극한직업,2019.02.05 21:18,4,5
2,욕설과 폭력성이 너무 심하다. 예고편만 보고 단순히 코미디라고 생각하고 갔는데 귀와 눈이 너무 더러워졌다. 가족끼리는 정말 보고싶지않다.,2019.02.04 19:01,4,5
2,재미없다. . .노잼이에뇨,2019.02.03 22:49,4,5
2,짬뽕영화입니다.잤어요,2019.02.02 16:30,4,5
2,평점이 이렇게 높을수가 있나..?,2019.01.31 00:03,4,5
2,이거왜이리 평점이 높죠? 완벽한타인은진짜개우꼈는데 이건좀억지웃음이예요 같이본친구도잼없대요마지막에 조금우낀부분도있었지만 대체적으로 걍그래요 아주못봐줄정도는아니지만 진짜걍그래요,2019.01.30 20:52,4,5
2,전형적인 욕범벅 깡패영화 스물때는 감동했었는데 실망이 크네요 돈벌려고 이걸 띄우는 사람들 실망스럽고 중1까지 같이 데리고가면 안되는 영화입니다 가족영화아닙니다 욕범벅 잔인해요많은 청소년들이 볼거없어서 보러가고있던데 ...,2019.01.30 19:52,4,5
2,화내고 싸우자고 덤벼들고 욕하고...빤히 보이는 너스레 떠는거 참 싫다. 한명씩 돌아가면서 불쑥 일어나서 대사치는것도 무슨 재미없는 연극 보는 느낌. 가끔씩 웃긴 장면도 있긴 하지만 그거 때문에 좋은 평가를 내리기엔...,2019.01.29 09:31,4,5
2,ㅂㄹ..보는 내내 시간이 안 갓음..,2019.01.23 20:21,4,5
2,대한민국 관객 수준을 보여주는 최악의 영화이게 천만 넘을 영화인가? 풉 아무리 대진운이좋았다고 해도 진짜 최악이다 수준들진짜 좋은영화는 안보고,2019.02.19 08:01,5,6
2,평점좀 내려야되서 2점줌 유치하고 지루합니다,2019.02.10 20:54,5,6
2,중국 3류 영화 입니다. 보는내내 너무 식상했습니다. 한국 영화수준이 이정도가 천만이라니...너무 따분하고 전개가 뻔한영화,2019.02.09 12:59,5,6
2,영화를  똥꾸녕으로  보나..이런 쓰레기가 10점이라니,2019.02.06 16:12,5,6
2,너무 재미없었어요. 돈과 시간이 아까웠던 영화,2019.02.05 17:37,5,6
2,내용이 진부하네요. 기대이하.,2019.02.05 15:35,5,6
2,평론가 평점 믿으면 안되겠네 로그인 하게 만드네..남들 다 재밌다고 하는거 알바냐? 아님 내가 웃음 코드가 안맞는건지?웃음코드는 떠나서 좋은배우들 하나도 못살리는 연출. 전개 ㅡ_ㅡ돈이 아까웠음,2019.02.04 23:10,5,6
2,개 쌉 노잼...이걸 재미있게 보는 사람들 수쥰...,2019.02.04 15:55,5,6
2,기대없이 보면 한껏 웃을 수 있을거란 평은 믿고 봤는데제겐 극한직업이 아니고 극한웃음이었습니다.도대체 어디가 웃기는거지? 다행이랄까 저랑 같이 봤던 그날 영화관의 관객들도 소소하게 웃는정도였어요.,2019.01.31 14:10,5,6
2,진심으로 이게 재밌나...,2019.01.30 12:43,5,6
2,"웃고 싶어서, 웃기 위해, 웃을 려고,  영화 봤는데, 너무 실망했다. 우울하다. 수많은 영화보고 왠만해서 평점 안남겼는데",2019.01.29 20:21,5,6
2,평점알바하는 애들이 극한직업 일듯,2019.01.28 21:21,5,6
2,저는 코드가 안맞는지 진짜 노잼 유치 ....영화보는 내내 보자고 한 남편만 째려봤어요 ㅠㅠ,2019.01.27 19:18,5,6
2,비디오용 영화.. 엄마랑 오랜만에 영화보러왔는데 돈아까워요... 여기 평점 뭐에요ㅠㅠ후기 뭐에요ㅠㅠㅠㅜ이거 믿고 봤는데....말모이볼걸 ㅠㅠ,2019.01.25 23:20,5,6
2,예고편이 제일 재미있었다.영화라고하기에도 부끄러운 수준의 유치한미취학아동용 허무개그물,2019.01.24 15:30,5,6
2,노잼입니다 절대 보지마세요,2019.01.23 20:20,5,6
2,내가 무슨 문제가 있는건가? 진짜 재밌었나요?,2019.02.15 00:21,6,7
2,웃기다고 하는 사람도있던데개인적으로 개그콘서트 보는느낌이었음. 옛날개콘말고 요즘개그콘서트. 무슨 일이 일어날지 다 예상이 되서 안웃겼음.,2019.02.10 22:00,6,7
2,그냥그랬다. 러브라인이 왜 필요했을까..,2019.02.06 21:21,6,7
2,"영화의시작은 좋았으나 진지한 부분이적어 감동을 주기에는 역부족인것같아서 남는것보다는 코미디같아 실망입니다.좀더 깔끔한 대사는 할수없는것인지,욕을 해야만 멋있다고 생각하는건 시대의병폐입니다.시간이 아깝다고할까?",2019.02.06 18:58,6,7
2,알바에 낚이지말고 내 글 믿으세요 개콘정도 웃음~ 중간에 졸았고 기대많이하면돈 아깝고 배신감 느끼게 됨,2019.02.05 15:06,6,7
2,나는 그닥..중간에 잠도 잤음..나는 별로였지만 같이간분은 잼나다고 좋아했음..그냥그랬음,2019.02.05 12:13,6,7
2,웃자고 봤는데 너무 현실성도 없고 마지막 키스신에서만 풋 하고 웃었네요 극장안에서 아무도 안웃습니다 비추!,2019.02.04 20:00,6,7
2,솔직히 솔직히 재밌다고???내내 억지였는데...,2019.02.04 19:49,6,7
2,진짜 솔직히 이게 재밌나요? 평점 이상하네...,2019.02.04 09:55,6,7
2,재미없어요.후기에 낚인듯,2019.02.04 01:41,6,7
2,B급 코미디를 따라하려는 노 코미디 영화,2019.02.01 11:09,6,7
2,"평점 처음 남겨봅니다. 평점에속아보긴첨이라..진지하게남깁니다.빵빵터진다고해서 좀 웃고싶어서 봤는데..다망한개그콘서트보는 느낌입니다.그쪽에서는 웃으라고 액션취하고 대사치는데,하나도안웃겨요.",2019.01.28 18:05,6,7
2,"어제동생이랑보고왔는데,솔직히 기대를 너무많이했나봐요,예고편에 재밌는장면 나온게 끝이던데요.메가박스 거의모든 상영관에는 극한직업이상영중이고 두세곳?상영관을 돌리면서 다른영화를 하더라고요,그건 솔직히 몰아주는것도 아니고...",2019.01.28 18:03,6,7
2,억지 웃음.... 저는 전혀,2019.01.24 22:53,6,7
2,아 너무 예상가능한 개그ㅜㅜㅜ,2019.01.24 22:31,6,7
2,"개그의 강약이 없다, 배우들의 연기가 아니었으면 최악의 영화였을듯...",2019.01.23 18:58,6,7
2,노잼 유치 참다참다 못참고 나왔네요ㅠ 류승룡 배우 좋아하는데 최근영화 다 아쉽네요,2019.01.23 15:33,6,7
2,이게 천만이라니....,2019.07.16 20:54,7,8
2,존나 기대해서 그런가.. 별로였음,2019.03.26 06:37,7,8
2,평점 9점 받을 정도로빵빵 터질 정도의 영화는 아니었다개그 코드가 있긴 했지만 억지스러운 웃음을유발하는 영화개봉 시기를 잘 만난거 같고경쟁작이 없어서 수혜를 입은 작품이다,2019.02.15 12:19,7,8
2,진짜 이게 무슨 천만 b급 코미디 영화임,2019.02.07 16:00,7,8
2,"댓글알바가 천지내, 가족들 같이 갔는데 욕과 폭력이 난무함, b급 영화, OCN에 무료로 나와도 안볼듯",2019.02.06 22:23,7,8
2,영화가 뻔하지 아니한가,2019.02.06 08:16,7,8
2,너무 억지로 웃기려고해서 별로였어여.. 웃음코드가 안맞았나봐여 다른분들은 재밌다고 웃으시는데 혼자 못 웃어서 너무 아쉬웠어요ㅠㅠ,2019.02.05 17:45,7,8
2,B급 감성의 코믹영화.. 전형적인 한국코믹영화..,2019.02.05 14:25,7,8
2,주변에서 생각없이 웃기다고 해서 봤는데 재미 없었음.. 중학생 정도 보이는 애들은 잘 웃더라..,2019.01.31 12:42,7,8
2,정말 진부하고 지루하고 재미없는 코메디 영화,2019.01.30 15:43,7,8
2,개그코드 사람마다 다르다지만 이건 거의 개콘 수준인데... 개콘 웃긴사람이 보면 10점 줄듯 난 한번도 못웃었다... 평점 9점댄거 보고 인생충격... 나 또라인가,2019.01.29 22:38,7,8
2,"시놉만 재밌었다. 열린마음으로 봤는데도, 웃질 못했다",2019.01.24 15:51,7,8
2,인간적으로 너무 높잖아..이런게 웃기나???,2019.02.15 08:18,8,9
2,진짜 ㄱ노잼인디...   오랜만에 영화관에서 꿀잠잤음.,2019.02.14 20:32,8,9
