별점(평점),리뷰내용,작성일자,공감횟수,비공감횟수
10,일단 진선규님 진짜 연기를 다양하게 잘하셔서 놀랐어요 오랜만에 부담없이 진짜 코미디 영화를 본거 같아서 즐거웠어요 조조로 할인받고 봤는데 반값이라 더 재밌어요 밤새다 할거없이 봤는데 최고~~,2019.01.23 11:45,10711,1036
10,진짜 뻥안치고 ㅈㄴ 웃겼다,2019.01.23 12:47,9129,1307
10,"계속 웃으면서 봤어요!""지금까지 이런맛은 없었다이것은 갈비인가 통닭인가수원왕갈비통닭입니다.""이 대사가 귓가에 계속 맴도네요 ㅎㅎ",2019.01.23 14:48,7347,755
10,지금까지 이런 영화는 없었다  이것은 영화인가 통닭광고인가,2019.01.23 20:16,7010,640
10,간만에 정치색 안띠고 마냥 한국식으로 웃긴 영화다~류승룡도 완전 찰지고ㅋ흥해라,2019.01.23 14:47,6129,644
10,류승룡 좀비설 너무 웃겼어여,2019.01.23 17:32,4591,427
10,마약반 형사들 각각 캐릭터가 확실했습니다. 겹치는 점도 없었고 조합도 너무 좋았습니다. 악역분들도 그 표정들하며 사투리와 찰진 욕설들.. 기억속에 남습니다. 웃으면서 행복했던 감정이 기억에 남습니다. 시사회로 봤지만...,2019.01.23 09:26,4521,523
10,완전 내스타일.. 류승룡 영화 요즘 말아먹더니 이번엔 대박 웃기네 ㅋㅋ역시 갓승룡,2019.01.23 12:48,4009,521
10,조조로 보고 출근중입니다. 저는 정말 미친듯이 웃었고.감동도조금 있었습니다.극한직업2 제작해주떼엽,2019.01.23 11:42,3156,511
10,류승룡: 여보 왜씻어....?,2019.01.23 20:53,2852,250
10,ㅎㅎㅎㅎ 2시간 내내 웃기다.신파도 없고 재밌다.한번더 보러 가야겠다,2019.01.23 13:22,2420,347
10,진선규ㅋㅋㅋ나보다 못생겼단말이 얼마나 상처받던지,2019.01.23 21:01,2177,222
10,올해 가장 재미있었다 아직까진,2019.01.23 13:02,2310,361
10,마지막에 공명 안아파~ 너무 웃겨,2019.01.23 14:15,1859,219
10,치킨으로 이렇게 웃기기 있기 없기?,2019.01.23 11:43,1672,326
10,ㅠㅠ진짜웃곀ㅋㅋㅋ 또볼꺼야ㅠㅠㅠ,2019.01.23 12:48,1581,300
10,진짜 개재밌음 꼭 보삼 류승룡씨는 오랜만에 흥행성공 하시겠네,2019.01.23 13:13,1298,234
10,감히 천만 예상 해 봅니다같은 생각 따봉ㄱㄱ,2019.01.23 22:27,1283,237
10,염력보고 충격받아서 류승룡 이번 영화 괜찮을까 망설였는데 ㅋㅋㅋ처음부터 끝까지 너무 웃김 ㅋㅋㅋㅋ영화관에서 다들 깔깔깔웃던데 ㅋㅋ스토리도 나름 탄탄함 ㅋㅋㅋ,2019.01.23 15:14,1121,205
10,"큰 기대없이, 별 생각없이 봤는데 많이웃었어요. 재밌게 봤습니다~편하게 보기 좋은영화~",2019.01.23 11:40,1077,224
10,중간에 엇나가지 않아서 끝까지 유쾌하고 재밌게 봤어요:):),2019.01.23 14:45,857,183
10,진짜 개꿀잼 시사회 두번갔다왔는데 오늘 아침부터 또 보러 갔다옴 3번봤는데 그냥 재밌음 내인생 영화임 배우들 케미 개쩔고 마약반 정말 잘어울림 연기 너무 잘함 처음부터 끝까지 재미있음 신하균 오정세도 따로 또 재밌고...,2019.01.23 12:14,871,244
10,극한직업 덕분에 많이 웃었네요ㅎㅎ 좋은 영화 감사합니다ㅎㅎ,2019.01.23 12:32,688,191
10,대놓고 약빤 감독이 대놓고 약빤 배우들 데리고 만든 극락의 히로뽕 같은 영화ㅎㅎ걍 웃다가 웃다가 웃다가 웃다가 끝난다ㅎㅎㅎㅎ코믹 영화로 스트레스를 풀수도 있다는 걸 34년만에 깨달은 하루ㅋㅋㅋ,2019.01.24 12:51,613,147
10,진선규배우님의 연기 짱!,2019.01.23 18:14,555,107
10,생각보다 너무 재미있었습니다 진선규님 코믹연기도 너무 잘하셔서 놀랐네요,2019.01.23 14:11,569,126
10,살다살다 감상평은 처음남긴다. 내 한국영화중 역대급이었음. 끅끅거리면서 웃어서 나갈때 배가 너무 아픈거 빼고 다 좋았음.,2019.01.23 22:16,596,210
10,개꿀잼이야 진짜 ㅠㅠ 꼭보세요 다들,2019.01.23 11:55,542,195
10,진선균님의 하드케리라 봅니당 배역 잘 맡으신둣,2019.01.23 15:16,398,102
10,이거 진짜 개웃김ㅋㅋㅋ 미쳤나봐 진짴ㅋㅋㅋ,2019.01.23 14:19,440,145
10,가게서 일해서 그런지 완전 공감감  신하균은 그와중에 잘생기고 공명 마지막에 진짜 울면서 봣어요 너무 귀여운데 미쳐 ㅠ 웃겨서 울면서 보긴 처음이네 2나오면 좋겠다 진짜 제발 12시 넘어서 봣는데 졸리지도 않음 음료...,2019.01.24 01:34,396,116
10,진짜 공명 미쳤어요 너무 웃기고 귀여워요,2019.01.24 21:27,368,107
10,안아파~안아파~  젤 웃겨 ㅋㅋ,2019.01.25 00:39,337,90
10,2시간동안 웃고나왔다,2019.01.23 15:55,377,133
10,"“지금까지 이런 맛은 없었다 갈비인가 통닭인가 수원왕갈비통닭”믿고 보세여..진짜 별?처음부터 끝까지 재미있고 웃겼던 영화연출도,연기자 분들도 다 완벽했던거같다",2019.01.23 21:58,314,111
10,기대 별로 안 하고 봤는데 연기도 연출도 좋았어요. B급 정서 물씬~ 계속 웃으며 봤어요. 억지 신파도 없고.,2019.01.23 16:03,240,82
10,너나좋아하냐? 부터 빵빵터짐ㅋㅋㅋㅋ,2019.01.23 21:58,250,95
10,꿀잼 안 보면 손해예요 짱,2019.01.23 13:08,295,147
10,말이 필요없다 꼭보셈 강추,2019.01.23 13:02,260,122
10,모든영화가 주제가 없으면 문제다. 근데 모든 영화에 주제가 있을필요도 없다. 그냥 이런 재미만 추구해도 좋지롱,2019.01.23 16:02,201,78
10,캐릭터 다 너무 귀여웠고 엄텅 재밋엇숩니다!!,2019.01.23 13:11,208,86
10,진짜 장르 애매하게 가다 어중이떠중이 되는 경찰물들 많은데 이건 정말 첨부터 끝까지 조오오오오온나 웃깁니다,2019.01.24 15:18,198,86
10,꿀언늬 욕 겁나 찰져요 ㅋㅋㅋㅋ마지막에 공명 약빨고 액션 개웃김 ㅋㅋㅋㅋ,2019.01.24 17:09,186,78
10,"간만에 극장에서 웃으면서 본 영화입니다! 현실성은 조금 떨어지지만, 코미디 영화답게 웃기는데는 최고였어요후반부 액션씬도 좋았습니다. 인생 캐릭터를 만난 공명 배우님과 코미디 영화에서 의외의 발견을 할 수 있던 진선규...",2019.01.24 17:06,172,78
10,진짜 신파극도 안나오고  개 웃겨요 ㅜㅜ,2019.01.23 13:35,174,86
10,올해 한국영화 나올때마다 이 영화랑 비교당할 듯 진짜 대박 ㅠㅠ 감독님 작가분이랑 평생 함께하세요,2019.01.23 12:55,202,114
10,웃고 싶을때마다 보는데 매번 웃기는 최애 영화.,2021.09.04 12:22,99,13
10,개꿀잼  쏴버려에서 개터짐,2019.01.24 17:13,157,73
10,지금까지 이런 영화는 없었다. 이 영화는 예고편이 다인 영화인가? 아닌 영화인가? 솔직히 예고편이 재미를 오히려 떨어트리는건 사실이지만 마약반 5인 케릭터가 겹치지도 않고 케미가 좋았다. 8점대 영화인데 1점대 테러...,2019.01.24 05:39,163,80
10,진선규 진선규 진선규 진선규 진선규 진선규 진선규 진선규 진선규 진선규 진선규 진선규 진선규 진선규 진선규 진선규 진선규 진선규,2019.01.23 21:23,131,55
10,대박나서 치킨광고 찍자!,2019.01.23 17:33,131,59
10,"맘껏 웃었어요~~이하늬배우 넘 찰지게 욕 잘함, 진선규배우!!!! 연기갑!!!",2019.01.23 21:44,138,70
10,간만에 꿀영화ㅠㅠㅠ 넘 재밌는거,2019.01.23 12:29,129,67
10,기분이 우울해서 보러갔는데 우울한기분이 싹 날아갈정도로 웃으며 봤습니다. 너무 웃겨요~~ㅋㅋ 공명 귀여워,2019.01.25 16:06,109,49
10,진짜 웃김 계속 웃었음 말 한마디한마디가 웃기고  약간 전개를 좀 끄는 느낌도 받음 그래도 재밌음,2019.01.23 20:17,118,59
10,진짜 너무하네요 ..영화가 너무뻔하고 영화관에 영화소리보다 사람들 웃음소리로 꽉차서 보는데 집중이안됫어요 ..그래서 저는 더크게 웃었어요 겁나재밌네요,2019.01.23 20:43,116,59
10,첨부터 끝까지 웃음밖에 없는 영화 ㅋ 대박 졸잼,2019.01.23 14:40,117,67
10,아무생각 없이 보면 급터지는 영화여요! 시사회때 보고 주변에 여기저기 입소문 퍼트리는 중이에요! 입소문으로 흥해라!! 공명이라는 분은 처음보는데 왜이렇게 귀엽게 연기잘함?ㅋ,2019.01.23 14:28,107,61
10,너무재밌고 쉬지않고 웃었습니다 강추드립니다,2019.01.23 21:59,92,47
10,다섯번은넘게본듯배우들너무찰지게웃겨요,2020.09.22 20:38,46,15
10,안 아파~ 안 아파~ 웃다가 숨넘어갈뻔,2019.01.25 06:43,54,24
10,믿고보는 류승룡   언발란스한  캐미?를  보여준  이하늬와  진선규   선비같은  생김과는 다른   맹한  캐릭을 보여준  연기변신의 귀재  공명!!이동휘는   음    투덜이   캐릭이 제일 잘어울리는 하지...,2019.01.31 20:24,38,11
10,줄거리 보고 기대했는데 기대만큼 재밌네요 특별한 내용이 있거나하진않지만 오랜만에 재밌는 영화본거같아서 돈이 아깝지 않네요,2019.01.23 21:21,32,6
10,그냥 엄청 웃김 영화관에서 다 같이 웃기 좋은영화,2019.01.25 01:25,36,10
10,진짜 재밌어요 배우님들 케미 최고구요 그 막내형사역할 누군가요  마지막에 마약 잘못먹고 마약에 취한 연기 너무 귀엽구 잘했어요!!!,2019.01.24 17:04,68,42
10,오랜만에 웃으면서봤네요,2019.01.23 12:59,68,42
10,다들 연기를 잘해서 연기 구멍이 없고 재밌었다 내용은 좀 뻔하게 끝나지만 그래도 나중에 다 때려잡는거 속은 시원했다 군데군데 대사들이 겁나 웃겼음,2019.01.25 01:47,35,10
10,정말 재미있어요..후기 평점 잘 안남기는데!! 요즘같이 팍팍한 세상살이극한직업같은 코미디영화가 많이 나왔으면 좋겠네요~!,2019.01.23 21:33,36,11
10,을 2시간동안 웃게해주는 영화. 더이상 뭐가필요하죠?,2019.09.16 01:23,44,19
10,마약반팀원들 모두가 어디 모자란 것없이 연기를 너무 잘 하셔서 너무 재미있게봤어요ㅋㅋ순간순간 모든 포인트들이 다 재미있어서 웃음이 끊이지 않았어요.,2019.01.31 18:55,29,5
10,지금까지이런영화는없었다,2019.08.14 02:27,38,14
10,생각없이 계속 웃을 수 있는 영화공명 귀여워요♡♡,2019.01.24 16:34,63,39
10,진짜 웃겨욬ㅋㅋ기대 하나도 안하고 봤는데 존잼ㅠㅠㅠ,2019.01.23 21:54,30,7
10,분위기 안흐리고 끝까지 이어가는 코미디가 좋았습니다 재밌게 잘봤어요!!,2019.01.23 21:57,40,17
10,지금까지 이런 코메디는 없었다 이게 영화인가 개그프로인가... ㄹㅇ 개콘보다 몇배는 웃김 영화보는내내 너무 웃으면서봤음ㅋㅋ최고!!,2019.01.23 23:12,71,48
10,안아프다 안아프다 인아프다 ㅋㅋㅋ,2019.01.25 02:19,48,26
10,진짜 이건 무조건 봐야해요 ㅎㅎ 설날에 나왔으면 더 대박 쳤을텐데,2019.01.23 14:17,53,32
10,5분에 한번씩 웃엇닼ㅋㅋㅋㅋ,2019.01.24 18:54,56,35
10,그냥봐ㅋㅋㅋ 시작부터 끝날때까지 졸잼이다 ㅋㅋㅋㅋ,2019.01.23 22:15,67,46
10,진선규님이 완성하심 공명 배우 졸귀탱또 보고싶다.,2019.01.31 20:57,36,16
10,순간순간 정말 웃기고 다양한 개그들이 많아서 좋았습니다^^그리고 마지막엔 통쾌했습니다~,2019.01.23 12:47,41,21
10,어제 봤음 ㅋㅋ 예고가 다가 아니더라 ㅋㅋㅋ,2019.01.24 17:05,42,22
10,아 예고편 보고 그냥 생각없이 봤는데 더한게 나옴 ㅋㅋ 오랜만에 웃다가 울면서 나왔다,2019.01.23 22:16,42,22
10,졸라 잼있습니다. 병맛화이팅!!,2019.01.23 15:52,44,24
10,배우 5분 모두 빠지는 분 없이 캐릭터 있고 연기도 진심 갑..시작하고 끝날때까지 웃은영화는 처음인듯,2019.01.31 18:23,23,4
10,다이어트중인 분들은 보지마세요. 치킨 먹고싶어지니까. 나는 그러므로 오늘 다이어트 4일째 치킨을 시킨다.,2019.01.24 17:25,25,6
10,유쾌하다!!! 요새 웃을일 없다싶으면 보자! 꼭 보자! 억지웃음없어서 좋았고 쓸데없는 신파마무리 없어서 더 좋았다. 구멍없이 마약반 캐릭터들 다 너무 매력있음!!! 깔끔! 유쾌!,2019.01.24 00:25,27,8
10,대본도 좋았고 모든 배우들도 맛있게 연기하더라 구멍이없었닼ㅋㅋㅋ진선규 이하늬 공명 배우 조합 좋았다,2019.01.30 23:56,30,11
10,극한직업 재밌어요!!!다들 보세요 공명 개귀여움ㅜ,2019.01.31 14:31,31,12
10,진짜 재밌었어요 웃기기도 하고 못생겼다고 한놈만 팬닼ㅋㅋㅋ,2019.08.17 21:13,32,13
10,간만에 머리 비우고 웃으면서 봤네요코미디 영화 좋아하시면 재밌게 보실 수 있습니다,2019.01.23 16:38,48,29
10,승룡이형 믿고보는 영화하늬누나 짱 멋있게 나오고선균이형은 얼굴보고 웃게되고공명이형 강아지 연기?ㅋㅋㅋ 웃겼어요결론은 10점만점짜리 영화,2019.01.26 21:54,49,30
10,처음부터 넘 웃겼는데 끝까지 웃기고 재밌었어요!! 공명님도 너무 귀엽고 ㅠ 영화 흥행했으면 좋겠어요 ㅋㅋㅋ,2019.01.24 19:01,52,33
10,보는내내 웃겨 죽을뻔 했다 이것은 치킨인가 갈비인가 ㅋㅋㅋ 앜,2019.01.25 01:30,25,7
10,시나리오 진짜 기막히게 써서 2재밌게 나왔으면좋겠다 !다시봐도 재밌어!ㅋㅋㅋ,2020.01.20 22:54,35,17
10,너무보는내내 기분이좋구 행복해지는 영화에요!,2019.01.26 01:04,21,4
10,재미있음ㅋㅋ시간순삭임,2019.01.24 01:31,25,8
10,대박! ㅋㅋ웃으면서 시작해서 웃다가 끝남!예고편보고 기대만빵 그게다인가 걱정했는데 예고편은 아뭇거도아님 ㅋㅋ 또보고싶단 생각잘안하는데 이번영화 또보고싶네! 캐릭터 확실하고 자기옷입은듯한 배우들의연기 정말 코믹액션제대...,2019.01.23 21:18,25,8
10,ㅋㅋㅋ 막내형사 마지막에 빵터짐,2019.01.27 14:41,26,9
10,공명보러 간건데 넘 재밌었움!!,2019.01.25 13:28,27,10
10,빠지는캐릭터가하나도없는 영화 재미있게잘보고 오랜만에 스트레스풀고왔어요 진선규님 공명님도 진짜 코미디가 일케어울릴줄이야,2019.01.27 14:30,31,14
10,진짜 걍 관객들 다같이 엄청 웃었다. 장르가 코미디인만큼 웃길거면 제대로 웃겨야 하는데 이 영화는 진짜 제대로 웃겨. 스토리도 나름 코미디치고 괜찮은? 연기도 탄탄하고. 오랜만에 이런 코미디 영화 보는 것 같다,2019.01.24 17:05,31,14
10,완전재미있음 ㅋ 강추합니다,2019.01.23 18:34,31,14
10,지금까지  이런  재미는 없었다이것은  천만인가 이천만인가,2019.01.23 23:10,38,21
10,공명한마디면  끝인영화,2019.01.27 09:48,41,24
10,생각없이 보러왔는데 겁나 우낌 막 엄청 스토리가 있는건아닌데 재밌음ㅋㅋ 입소문 날거같은 영화 말장난이 겁나우끼고 빵빵터짐ㅋㅋㅋ 공명 이 배우 겁나 기여움ㅋㅋ,2019.01.26 22:24,42,25
10,진짜 갯꿀잼 친구랑 또 보러갈꺼임 진짜 웃김 ㅠ 아 설명할 길이 없다 진선규 배우님 넘 멋짐 ㅠㅠㅠ 이하늬 짱 ㅠㅠㅠ,2019.01.23 19:34,44,27
10,영화관에서 이렇게 웃기는또 처음이네요. 진짜 재밋습니다!!,2019.01.24 04:30,45,28
10,처음시작해서 끝날때까지 웃다가 나왔네요5명모두 캐미가좋고 조연들도 재밌고 이병헌감독 특유의 대사표헌방식이 너무재밌어요오랫만에 정말 아무생각없이 즐겁게 웃으면서 본것같아요 ^^,2019.01.23 23:10,45,28
10,연기력에 출중한 배우들만 모여 합을 맞추니 어색함이 없었고 무엇보다 어디에서 관객의 웃음을 잘 유도할 수 있는지 인지하고 있는 몇 없는 한국 작품이었습니다. 배우들도 고생하셨겠지만 감독님 또한 존경스럽습니다 다음에도...,2019.07.24 03:57,19,3
10,처음부터 끝까지 진짜 재밌었다,2019.01.23 20:18,22,6
10,이건 미쳤다 시작부터 끝까지 킬링타임 어진다,2019.01.24 01:30,23,7
10,진짜개웃겼어요ㅋㅋㅋ 남친이랑헤어지고우울했는데 엄청웃었음ㅎㅎ,2019.01.24 01:30,23,7
10,뻔하다고 하면 뻔한 내용과 결말인데 너무 재밌었음. 그냥 2시간 생각없이 웃고 나올수 있는 영화,2019.01.24 01:20,21,6
10,올해 최고로 웃기고 액션까지 좋은영화~~인정!!!!,2019.01.23 21:54,21,6
10,ㅋㅋ공명 깨알 역할 톡톡 ㅋㅋㅋ,2019.01.31 13:16,22,7
10,진짜 그냥 막 웃었네요. ㅋ 막내 약쩔은 연기 지금 생각해도 빵 터짐,2019.01.27 22:03,22,7
10,가볍게 보기 좋은영화계속 웃었어요,2019.01.25 01:26,22,7
10,지금까지 이런맛은없었다 이것은 갈비인가 치킨인가,2019.01.24 17:25,22,7
10,지금까지~이런 영화는 없었다~~~ㅎㅎㅎ,2019.01.27 00:50,24,9
10,재밌었어요 수원왕갈비통닭 최고,2019.01.23 14:01,25,10
10,처음부터 끝까지 웃긴영화. 애드립인가 싶을정도로 끝나겠지 하는데도 웃겨줍니다. 진선규에 이어 마지막에 공명이랑 류승룡땜에 대박웃었네요. 또 보고싶은영화!,2019.01.31 19:12,26,11
10,개존잼입니다 크크크크ㅡ크크크,2019.01.23 18:03,26,11
10,"대놓고 웃긴 영화, 박장대소 하면서 즐겁게 봤습니다. 너무 즐거운 시간이였어요~",2019.01.24 17:20,27,12
10,끝날 때 까지 계속 웃었다.,2019.01.23 14:31,27,12
10,와하하하하너무재밌게 잘봤어요. ^^모든 배우분들 정말 재밌었어요.  기분좋게 극장을 나왔습니다.,2019.01.23 20:11,29,14
10,"쏴~~~끝까지 웃겼다는 점에서 요근래 본 한국 영화 가운데 단연 최고의 장르(?) 영화! 대사와 리액션이 탁월한 제대로 연출된 구강액션 코미디. 류승룡의 부활과 신하균 오정세 콤비, 진선규 공명의 의외의 반전 매력 ...",2019.01.31 06:52,30,15
10,111분 시간 가는줄 모르고 잼나게 봤어요.핵잼~눈물나도록 웃었어요~^^,2019.01.23 21:05,30,15
10,진짜 진짜 너무 재밋어요 꼭보세요,2019.01.23 19:33,30,15
10,애기낳고 6갤만에영화진짜 진선규 공명 짱귀두시간동안 애기 까먹고 웃다왔음 천만넘기를,2019.01.26 00:21,31,16
10,줄거리가 다 예상가능하지만 연기로 채운 재미 굿입니다,2019.01.23 14:44,31,16
10,모든배우를다시보게됨 공명..드라마보고안좋아했는데영화보고팬됨 내가누군지아니 하늬님도완전사랑하게됐음 진선규님 와~~역활찰떡ㅎㅎ이동희 뭔가멋짐♡류승룡전편영화보고헉했는데역쉬굿굿,2019.01.26 00:07,32,17
10,스트레스 받으신분들 꼭 보세요 ㅋㅋ 천만각이다 ㅋㅋ,2019.01.23 21:52,32,17
10,굿 삼류영화 아님볼만함,2019.01.23 21:51,33,18
10,ㅋㅋㅋ 진짜 실관람평인데 끝날때까지 웃다가 나오네요 ㅋㅋㅋㅋ 꼭 봐요 ㅋㅋㅋ 하 여친이랑 진짜 후회없이봤네옄ㅋㅋ 개꿀잼ㅋㅋㅋ,2019.01.23 21:37,36,21
10,요근래 본것중에 제일 재미있었다존잼!! 공명 흥하라!!,2019.01.26 02:58,37,22
10,진심 재밌고 웃겨요 ㅠㅠㅠㅠ  짱이였엉,2019.07.24 22:18,17,3
10,좋아요 아주 즐겁게 분 영화에요,2019.07.24 14:40,17,3
10,"이제는 이런 영화도 좋다. 끝임없이 터지는 개그, 배우들의 열연이 조금 허술한 스토리, 유치할 수 있을 뻔한 영화를 살렸다.",2019.07.23 10:15,17,3
10,제가 원래 한국코미디영화는 극혐하는 편인데  요건 최고네여,2019.07.23 01:33,17,3
10,쉴틈이 없었다 총좀빌려줘 쏴,2019.01.23 21:08,18,4
10,영화 시작하는 순간부터 나올때까지 웃느라 배에 근육경련이 왔네요 ㅋㅋ 꿀잼!!!,2019.01.23 20:44,18,4
10,대박ㅡ영화ㅡ넘 넘 잼나고 강추,2019.07.23 18:42,15,2
10,진짜 완전 재미잇게 봣어요 굳,2019.07.24 22:15,16,3
10,류승룡 진선규 이하늬 이동휘 님 물론 쩌는연기였지만 워낙 연기로 정평 나있는분들이니 그렇다쳐도 저는 공명 님  의 재발견이라생각해요 이정도로 임펙트 있는 코믹연기를 소화 해내실줄이야 .1 정말  재밌게 잘 봤습니다,2019.02.01 13:12,18,5
10,진짜 꼭보셈 예고편 너무 재밌어서 저정도까진 아니겠지하고 기대안하고봤는디 기대이상..,2019.01.24 01:30,18,5
10,오늘 보고왔는데!! 재미있어요!! 구냥 가서 웃으면 되용,2019.01.23 21:59,18,5
10,공명 너무 귀여워ㅠㅠㅠ,2019.02.01 16:05,20,7
10,간만에 영화 보고 스트레스 확 풀림ㅠㅠ 잼따,2019.01.23 12:41,20,7
10,생각할 거 많아 머리 복잡스러운데 아무 생각없이 보며 미친듯이 웃었네요. 제 웃음코드랑은 딱입니다!,2019.01.24 19:07,21,8
10,감동1도없이 계속 웃겨요 끝까지코믹영화란  이래야지요,2019.01.24 01:25,21,8
10,핵잼이었습니다!!’진짜 또봐도 되는 영화,2019.08.14 20:29,24,11
10,와 12000원 아깝지않다 존잼 억지웃음도 아니고 ㅎㅎㅎ오늘 치맥  각ㅋ ㅋ 존잼,2019.01.24 18:53,26,13
10,공명 약빨고 싸울때 진짜 개웃교요 ㅋㅋ,2019.02.06 19:19,13,1
10,배우들이 원래 믿고보는 분들이라 기대하고갔는데 역시 연기 정말 잘 하시고 몰입도가 너무 좋았어요 ㅜㅠ 스토리진행도 뭔가 막장이 아닌 탄탄하게 진행되는 것 같아서 좋았어요 특히 공명 너무 귀엽고 앞으로 티비에서도 자주...,2019.02.05 18:10,13,1
10,걍 웃김 진짜 레알 웃김류승룡 이하늬 진선규 이동휘 공명 연기 쩜,2019.02.05 10:53,13,1
10,진짜 개웃겨요 공명 귀여워...,2019.02.03 13:20,13,1
10,재밌게본 한국영화 였습니다!,2021.11.30 15:50,14,2
10,잡으러 가도 됩니까아!! 어 기다려ㅋ,2019.01.31 19:56,14,2
10,다섯 배우님과 감독님 케미가 최고예요!!진짜 재밌었어요.,2019.01.29 16:58,14,2
10,역시류승룡이야 너무 재밌어요,2019.07.23 14:51,15,3
10,마지막에 야구부 스핀돌기땜에 10점준다,2019.02.03 02:15,15,3
10,공명이 이렇게 연기 잘하는 배우였다니..,2019.02.02 01:43,15,3
10,"최곱니다 정말!! 웃겨서 눈물나는 영화 오랜만이네요 퇴직금, 안아파, 쏴버려는 진짜..울었네",2019.01.31 19:53,15,3
10,공명 배우의  깨알 연기  넘 귀여웠어요~~^^주연 배우 다섯분의  연기와  신하균 오정세씨의 짧지만  명연기에  엄지척!!웃음 빵빵~가는 시간이 넘 아쉬웠어요넘 캐스팅이  잘 된 듯 해요~~♡♡♡1000 만 응원합...,2019.01.27 21:50,15,3
10,편하고 부담없이 끝까지 웃기는 영화,2019.01.25 01:32,15,3
10,빵빵 터져요 너뮤 재밌음요 ㅠㅠㅠㅠ,2019.01.24 04:43,15,3
10,두말하면잔소리 너무너무 잘 보고왔어요,2019.07.25 19:44,16,4
10,간만에 한국영화 제대로 봤네ㅋㅋ,2019.01.24 01:29,16,4
10,공명이란 배우를 발견 할수있었고 전부 케미가 잘맞었어요 ! 이하늬도 너무 예쁩니다...,2019.01.31 20:16,18,6
10,천만 가자^^재미보장. 내용도 있다,2019.01.27 00:50,19,7
10,극장가서 이렇게 대놓고 웃긴첨이다ㅋㅋ,2019.01.25 01:18,20,8
10,웃다 배찢어짐. 회사스트레스 다풀림.ㅋㅋㅋ 킬링타임용,2019.01.24 21:42,20,8
10,"여러분 존,나재밌어요 진짜로 꼭봐요 하 또보고시퍼요 레알",2019.01.25 01:27,21,9
10,5인 모두 최고.웃다 울음,2019.01.24 17:16,21,9
10,방금 보고왔는데 치킨을 기준으로 소재를 만들어서 뻔하면서도 기상천외한 내용으로 나온 영화네요!! 너무 웃겨서 크게 엄청 웃고싶었습니다 ...만 영화관이라 자제했어요 배우분들 케미도 좋고 연기못하는사람이 없고 재밌습니...,2019.01.23 21:05,21,9
10,ㅋㅋㅋ역대급 그냥 겁나 웃김 지루할 틈이 없음 ㅠㅠㅠㅠ,2019.01.23 14:37,21,9
10,재미있게 잘봤습니다!,2019.01.23 14:22,21,9
10,첨부터 끝까지 재밌었음 진짜 후회안함 천만 찍을듯,2019.01.23 13:03,22,10
10,진짜 제일 재밌어요 짱짱 계속 다시 보고싶을 정도,2019.08.17 22:31,24,12
10,난 막내형사(공명)가 너무 웃기던데..ㅋㅋ,2019.01.27 22:27,24,12
10,대박 천만영화다~~~~,2019.01.24 01:17,24,12
10,진짜 살면서 처음으로 영화 후기 남기는데 보는 내내 웃는 시간이 더 많았던거 같음 알바 아니고 리얼루다가 아무리 무미건조한 사람이라도 열댓번은 웃을거 같음,2019.01.24 01:07,24,12
10,간만에 극장에서많이 웃고 나와용 배우들 각자 매력적이양,2019.01.23 20:20,24,12
10,엄청 웃다왔네요 공명ㅋㅋ,2019.01.26 21:44,25,13
10,정말 재밌게 봤습니다~,2019.01.23 18:15,26,14
10,3분에 한번씩은 터진다,2019.01.24 04:57,27,15
10,너무재밌어요ㅎㅎ 개인적으로 공명배우님 너무 웃겼어요ㅎ,2019.01.27 12:52,28,16
10,진심 웃기려고 작정한 영화,2019.01.24 01:22,28,16
10,진짜 개재밌다.공명은 별로 웃기다가 후반부부터 캐리,2019.01.25 07:19,29,17
10,"공명 ""안 아퍼""가 머릿속에 계속 떠오름ㅋㅋ",2019.02.06 23:24,11,0
10,완전 웃기네ㅋㅋㅋㅋ공명 트리플악셀 잘봤습니다ㅋㅋ,2019.02.06 22:44,11,0
10,너무 웃다가 나왔어요ㅋㅋ 공명 최고,2019.02.06 19:16,11,0
10,신파요소 없이 깔끔하게 끝나서 너무 좋았고 배우들 연기가 진짜 대박이네요 이하늬님 연기도 다시 봤고 진선규님은 진짜 대박 ㅋㅋ 류승룡 이동휘 공명 다들 말할것도 없이 너무 좋았어요 요즘 코미디 영화라고 해도 하나도 ...,2019.02.05 18:16,11,0
