별점(평점),리뷰내용,작성일자,공감횟수,비공감횟수
9,ㅋ.ㅋ.ㅋ.ㅋㅋ.ㅋㅋ.ㅋㅋ.ㅋ.ㅋㅋㅋ.ㅋㅋㅋ.감독님. 한줄 평 이거면 된다 하셨죠??? 크큯 류승룡신하균오정세 나오는데 걍 무조건 봅시다. 오랜만에 참 재미,2019.01.26 17:55,1,2
9,살짝 오글거리는거 빼면 괜찮네요,2019.01.25 15:59,1,2
9,기대도 안했는데 월척이네 ㅎㅎㅎㅎ 스물도 미쳤더니 이것도 그러네 ㅎㅎ 웃음의 리듬 감각을 아는 감독님 ♡♡♡,2019.01.24 18:31,1,2
9,"어줍잖은 신파가 없다, 끝까지 웃음을 주려고 애쓴 흔적이 보인다, 다만 러닝타임이 약간은 길어보인다.",2019.01.24 16:23,1,2
9,재밌었어요 ㅎㅎ 코미디 영화를 시사하면서 보는게 더 이상해요 ㅎㅎ,2019.01.24 10:40,1,2
9,신나게 즐겁게 보기 좋은 영화 :),2019.01.23 12:21,1,2
9,재밌게 웃을 수 있는 영화는 오랜만인듯,2019.01.23 12:15,1,2
9,영화관에서 이렇게 많이 웃으면서 본 영화도 진짜 오랜만이네요,2019.01.23 12:07,1,2
9,조조로 봤는데 배우들 연기 미쳤고 코미디라 엄청 웃기네요 재밌게 봤는데 현실성 떨어지는건 사실임 그래도 돈내고 봐도 아깝지 않고 재밌음 추천합니다,2019.01.23 11:59,1,2
9,1점을 깎은 이유는 그놈의 지긋지긋한 경찰검찰 소재의 한계. 그래도 간만에 시간가는줄 모르고 본 국산영화였다,2020.04.21 23:57,2,3
9,코믹이 무엇인지 제대로 보여주는 영화. 보는 내내 웃겼다.,2020.01.11 19:15,2,3
9,종반부가 좀 아쉽지만 간만에 입 찢어지게 웃었네.,2019.10.12 00:11,2,3
9,아놔  이걸 극장에서 봤어야 하는건데.. 진심 웃김 아 내가 왜 극장에서 안봤을까..,2019.04.15 22:25,2,3
9,볼만합니다. 요즘 코미디 영화가 대부분 별로라 이 정도만 해도 감사함,2019.03.25 15:07,2,3
9,재밌게 잘 봤어요~근데 너무 기대했나봐요 ㅋ 별 하나는 뺍니다,2019.03.23 01:04,2,3
9,"군더더기 없는 구성, 타율 높은 조크, 명배우들의 앙상블, 그리고 기가막힌 편집리듬. 한국에 이런 상업영화는 없었다 ㅋ",2019.03.18 21:25,2,3
9,무상념 극한 코미디... 걍 잼나게 보고 웃으면 된다 !!!,2019.03.16 15:13,2,3
9,지금까지 이런 영화는 없었다. 이것은 예능인가 치킨광고인가 ㅋㅋㅋㅋ,2019.03.11 18:48,2,3
9,웃기 바빴던 영화..너무 잼있었어요~^^,2019.03.11 12:16,2,3
9,오랜만에 신나게 웃은 영화,2019.03.03 17:08,2,3
9,재밌습니다.. 류승룡님의 진지하면서도 코믹스러운 연기도 좋았습니다~,2019.03.03 14:45,2,3
9,재미었었여...ㅋㅎ...,2019.03.01 14:54,2,3
9,계속해서 웃게되는 장면의 연속이면서도 왠지  짠하기도 했습니다. 류승용님을 비롯해 배우들의 연기 좋았습니다,2019.03.01 12:18,2,3
9,재밋었어요ㅋㅋㅋ이하늬 존예,2019.03.01 02:11,2,3
9,오랫만에 크게웃다감 정말꿀잼,2019.02.27 13:38,2,3
9,"이미 내용을 다 알고 봤는데도 재밌더군요 배우들의 당황하는 얼굴, 좋아하는 얼굴, 그리고 마지막에 신중한 얼굴이 떠오릅니다",2019.02.27 13:25,2,3
9,웃기 위해 만든 영화 간만에 시원하게 웃었습니다.,2019.02.27 13:24,2,3
9,"솔직히 재밌다. 현재 우리나라국민 전반적인 개그코드에 잘 맞춘 코미디영화. 소재도 굉장히 신선함. 무엇보다 코미디영화에서 쉽게 저지르는 실수인 되도않는 ""조선식 신파감성""을 넣지않아서 좋았음. 장르에 ...",2019.02.22 10:43,2,3
9,너무너무너무재밌었어여,2019.02.16 14:33,2,3
9,"한국 코미디 영화의 지겨운 클리셰들이 없어서 좋았음. 신파, 소수자 비하, 보기에 불편한 더러운 개그로 점철되던 한국 코미디계에 극한직업은 아주 신선함. 이병헌 감독 다음 작도 기대됨.",2019.02.16 12:53,2,3
9,굳굳 너무재밌었고 2시간동안 웃음이 끊이질 않았다,2019.02.15 17:01,2,3
9,그냥 그럼.. 왜 높은지 모르겠다,2019.02.13 21:04,2,3
9,재밌게 봤습니다 되게 재밌었어요,2019.02.13 08:57,2,3
9,배우들이 다 연기를 잘 해서 재밌게 봤어요^^,2019.02.12 23:28,2,3
9,진짜 재미를 위한 영화!! 20번이상 웃고 왔어요,2019.02.12 20:37,2,3
9,아내가 하도 웃어서 집중하기 힘들었다는...,2019.02.12 20:01,2,3
9,정말 재밌어요~~ 가벼운마음으로 부담없이 보고오세요,2019.02.12 19:53,2,3
9,신파없이 마지막까지 정통으로 웃겨버려서 좋았어요^^,2019.02.12 14:05,2,3
9,대사 한마디 한마디 마저도 너무너무 재밌었습니다~,2019.02.11 19:03,2,3
9,꾸울재앰 끝날때까지 웃김,2019.02.11 12:13,2,3
9,재미있고 유쾌하다. 한명한명 너무 웃긴다.,2019.02.11 02:29,2,3
9,딱 재미만을 위한 영화였다.,2019.02.11 01:00,2,3
9,폭소 작렬!! 내용은 팔십점!,2019.02.11 00:21,2,3
9,가족과 같이 보기 좋은 영화,2019.02.09 16:40,2,3
9,아들이 정말 재밌다고 하네요^^개그프로에서 보던 잠복근무가 진짜 영화로 나왔네요...,2019.02.09 14:37,2,3
9,엄청 재미있고 마지막에 좀비씬이 재일 웃김,2019.02.09 06:05,2,3
9,쉴새없이 웃고 즐기기에 좋은 영화입니다,2019.02.08 03:16,2,3
9,이런 웃음 코드면 인정~,2019.02.08 03:16,2,3
9,지금까지 본 영화중 제일코믹한 영화!,2019.02.08 01:58,2,3
9,너무 재밌게 봤습니다!,2019.02.08 01:00,2,3
9,눈물나게 웃으며 봤네여^^,2019.02.06 20:34,2,3
9,정말 재밌음. 군더더기없고 세련됐음.,2019.02.06 20:12,2,3
9,영화 보는 내내 신나게 웃다가 극장을 나왔네요~~^^왜 입소문이 났는지 알겠어요^^,2019.02.06 16:29,2,3
9,모든배우들의 합이 좋았던 시종일관 웃게만드는 작품!,2019.02.06 16:12,2,3
9,너무 웃겨요막판에 약간 늘어지는감이 있긴하지만재밌어요,2019.02.06 16:10,2,3
9,코미디 영화로는 역대급인듯. 자연스럽게 웃기는 장면이 많고 부담없이 편하게 볼 수 있어서 좋았습니다. ^^,2019.02.05 17:38,2,3
9,계속 웃었어요. 억지웃음을 짜내는게 아닌 너무 즐거운 시간였어요. 또 봐도 좋을것 같을정도예요,2019.02.05 09:05,2,3
9,겁나 웃낌ㅋㅋㅋ호ㅋㅋㅋ,2019.02.04 19:40,2,3
9,요근래 본 영화 중에 제일 재밌었습니다,2019.02.01 14:01,2,3
9,결론만 말하면 성공한 코미디임 재밌긴함 진짜로 ㅋㅋㅋ근데 코미디가 90을 잡고가는느낌이라 너무 뭔가 선을 넘은 느낌이 2~3%정도 없지않아있음. 방금보고옴. 결론. 개꿀잼.ㅋㅋㅋㅋ꼭봐라 안보면 후회한다,2019.01.28 00:49,2,3
9,생각보다 재밌었고 사람들 반응도 좋았어요,2019.01.23 12:28,2,3
9,개그 하나는 확실한 영화. 캐릭터도 확실하고 중간중간 흐름은 뜬금없지만 개그 하나로 다 중화가능함.,2020.01.26 23:17,3,4
9,재밌었습니다 ㅎㅎㅎㅎ,2019.03.25 20:22,3,4
9,각자 웃음코드가 다르겠지만 아무 생각없이 보기 좋은 영화였어요,2019.03.25 20:03,3,4
9,오우~너무 웃겼다 ㅋㅋ,2019.03.24 17:10,3,4
9,물흐르듯 흘러가는 코미디의 미학,2019.03.17 19:22,3,4
9,한국코메디영화 별로 안 좋아하는데 진짜 지루할 틈 없이 빵빵 터졌음!,2019.02.10 00:41,3,4
9,재미있게 봤어요~~ 연기력도 좋고 유머도 있고 즐길만한 영화예요~,2019.02.01 15:26,3,4
9,이거보고 노잼이라고 하는사람들 둘중 하나임 영화관에서 혼자끆끆 대면서 봐놓고 영화관 나와서 괜히 수준높아보이려고 뭘 이런거보고 웃나 하는사람 or 뭘 해주고 뭘 보여줘도 늘 불평불만만 하는사람 ㅇㅇ ㅅㄱ,2019.01.28 11:59,3,4
9,핵잼 생각없이 웃고 보다 나오면됨,2019.01.28 00:45,3,4
9,"시간가는줄 모르고 봤다. 흔한 한국 코미디 수사물인 건 맞는데, 재미는 있었다. 다만 어린 아이와 보기에는 욕이 많이 나옴. 간만에 영화관에서 웃었습니다.!",2019.01.27 12:52,3,4
9,치킨에 장난치면 잦되는거여,2019.01.23 11:34,3,4
9,ㅋㅋㅋ 약빨고만든듯ㅋㅋㅋ 간만에 영화보면서 많이 웃었다,2019.04.19 16:48,4,5
9,쉬는구간없이 계속 웃을수 있는영화,2019.02.13 16:56,4,5
9,가족끼리 연휴에 보기 너무 좋았던 영화.,2020.02.06 00:03,5,6
9,1.코미디 영화의 결정판 끝판왕2.감독님 특유의 말맛!3.한국이니까 가능한영화,2021.07.10 22:23,0,2
9,개봉할때 극장에서 보고 최근에 한 번 더 보았네요^^ 배우들의 코믹연기가 인상적이고 치킨이라는 소재도 재미있게 활용되었습니다! 가볍게 웃고 즐기기에는 딱입니다~!! 다시 봐도 골때리게 재밌네요 ㅋㅋㅋ,2021.07.04 23:33,0,2
9,웃깁니다. 졸 웃겨요. 힘들거나 웃음이 필요한 사람들에게 추천합니다.,2021.04.11 04:20,0,2
9,한국 코미디에 부활 한국 코미디영화는 유치하고 재미없다는 편견을 깬 작품,2021.03.15 03:40,0,2
9,이렇게 웃긴 한국 영화는 오랜만!,2021.03.15 00:01,0,2
9,요즘 같은 시기에 이런 영화나 많이 나왔으면 좋겠어요...좀 웃을 수 있게요~,2020.08.23 23:35,0,2
9,앞으로 모든 한국 코미디는 이 영화와 비교당할 거임. 봐도봐도 여전히 재밌음. 지금 보면 배우들도 다 조연까지 장난아님. 이렇게 군더더기 없는 코미디 영화는 당분간 나오기도 힘들거임. 이 걸 재미없다고 1점 준 놈들...,2020.08.23 16:12,0,2
9,,2020.08.23 02:49,0,2
9,,2020.07.16 22:47,0,2
9,2시간 내내 잃지 않은 웃음스탠스 이게 코미디지!,2019.05.07 19:06,0,2
9,기대가 큰만큼 솔직히 약간 실망도 했지만...그래도 최근 코미디물중엔 가장 잼있게 본듯합니다.,2019.03.14 17:20,0,2
9,솔직히 명량보다는 재미남 2 이딴것만 만들지 말자,2019.03.14 09:31,0,2
9,하루를 즐겁고 행복하게 마무리해줄수 영화입니다.,2019.03.13 23:12,0,2
9,이 감독님 확실히 코미디 영화 잘 만드시는듯. 스물도 정말 재밌게 봤습니다.,2019.03.12 00:56,0,2
9,우리나라 영화 맨날 조폭or마약관련이라.. 그런 부분만 빼면 너무 재밋엇어용 ㅠ,2019.03.11 04:26,0,2
9,불가능한 상황을 극복하게 하는 한 가지 마법은 코믹이었다,2019.03.11 00:49,0,2
9,치킨이 너무 먹구싶다..,2019.03.10 22:51,0,2
9,실컷웃다나왔네요재밌습니다~^^,2019.03.10 22:01,0,2
9,가족이서 보기 재미있는 웃기는 영화 ㅋㅋ,2019.03.10 21:39,0,2
9,"수준높은  유머러스^^^ 넘 재미있었습니다.  다음  작품 기대하겠습니다,",2019.03.10 21:20,0,2
9,한국영화중에 오랜만에 재미있게 봤다 ㅎㅎ,2019.03.05 22:31,0,2
9,조금은 유치하지만 재밌습니다. 추천 할만한 영화,2019.03.05 20:08,0,2
9,설 연휴에 친척들이랑 다 같이 관람했습니다. 재미있어요~ 특히 어른들께서 좋아하셔서 더 만족합니다 ㅎㅎ,2019.03.05 14:27,0,2
9,첨부터 끝까지 실컷 웃었네요...,2019.03.05 13:58,0,2
9,진선규 웃겼다^^ 재밌었다,2019.03.05 13:21,0,2
9,간만에 유쾌하게 봤습니다~! 배우들 연기도 모두 잘하고.. 웃으면서 너무 재밌게 봤어요~! 부모님도 보여드렸는데 재밌게 보셨다고 하네요!,2019.03.05 11:49,0,2
9,웃음 폭탄! 강추합니다.,2019.03.05 11:41,0,2
9,온가족들이 깔깔깔  정말 재미있게 보고 왔습니다. 별 반쪽을 뺸건 아이들이랑 같이 봤는데 ㅋㅋ 욕이 너무 많이 나와서예요!,2019.03.05 11:26,0,2
9,재미있게 본 영화다.  근데  누적관객이 이렇게까지  많아질줄은 몰랐다..,2019.03.03 19:21,0,2
9,재미있게 봤습니다 ^^,2019.03.03 00:04,0,2
9,ㅋㅋ간만에 아무생각없이 볼만한 영화!,2019.03.02 23:05,0,2
9,진주인공이 진선규배우님임ㅋㅋㅋ가볍게 보기에 최고인 영화,2019.03.01 22:08,0,2
9,웃긴 영화. 덕분에 잘 웃었습니다 1500만 기록한건 축하할만한 일이지만 단순히 웃긴 영화가 여러 명작을 제쳤다는 점에서 의아한 부분도 있습니다,2019.03.01 21:42,0,2
9,주말에 아들이랑 봤는데 잼있었어요^^,2019.02.28 17:28,0,2
9,"계속 웃다가 나옴 ㅋ,ㅋ",2019.02.27 23:39,0,2
9,재밋음 킬링타임용으로 제격. 오랜만에 영화보며웃음 평점 깎기 싫어서 9점줌,2019.02.27 02:27,0,2
9,재밌었어요. 유쾌상쾌통쾌~,2019.02.26 13:44,0,2
9,보통 극장가면 출발비디오여행에서 나온게 절반이상인데.. 극한직업은 그 이상이었음. 간만에 재밌는 코믹물 봤습니다.,2019.02.26 10:18,0,2
9,좋은 캐릭터에 좋은 배우가....,2019.02.26 07:46,0,2
9,오랜만에  정말 재미있게 본 영화 인것 같습니다.,2019.02.25 23:51,0,2
9,그냥 아무생각 없이보면 웃긴 영화,2019.02.25 14:28,0,2
9,시간가는줄 모르고 재밌게 봤습니다.,2019.02.25 12:51,0,2
9,중2 아들과 봤는데 인생에 있어 제일 재미있었다고 하네요.수요일날 문화의 날에는 다른 영화 볼 생각입니다.,2019.02.25 12:36,0,2
9,이정도면재미있게 잘만든거 아닌가 ㅎㅎ,2019.02.24 22:21,0,2
9,간만에 가벼운 마음으로 보기 좋은 국산 영화 였습니다,2019.02.23 00:40,0,2
9,유쾌하고 즐거운 영화~~~~,2019.02.20 18:01,0,2
9,올해들어 제일 웃으면서봤닼ㅋㅋㅋ,2019.02.20 13:58,0,2
9,예고편 보지말고  볼걸 ... 그래도 볼만한 영화,2019.02.19 15:38,0,2
9,"천만도 넘었다길래 봤는데 재미있는건 인정 류승룡의 연기력이 돋보엿고, 난 남자인데 이하늬는 그전엔 별로였는데 이 영화에서 보여준 이하늬는 캐릭터 잘 살린거 같더라! 암튼 잼나게 봣음! 10점 만점까진 아닌거 같고 9...",2019.02.19 14:59,0,2
9,끝날때까지  웃으면서 본 영화. 너무너무 재미있게 본 영화.,2019.02.18 12:35,0,2
9,오랜만에 코믹한 영화를 보았습니다 연기자들의 연기력이 뛰어납니다 재미있어서 시간가는줄 몰랐네요~^^,2019.02.17 23:54,0,2
9,내안에그놈보다 훨씬재밌어요,2019.02.17 21:18,0,2
9,오랫만에 증말로 재밌게봤네요옆자리 앉은 울딸 보는 내내 까르르 넘어 갑니다.,2019.02.17 18:56,0,2
9,뭐 일단 재미있습니다.,2019.02.17 18:44,0,2
9,"편하고 재미만점, 스트레스 해소에 넘 좋아요.",2019.02.17 16:35,0,2
9,능력자 김여사가 등장한 초반부터 웃음! 큰 한방보단 소소한잽의 성공률 대박!!!,2019.02.17 16:31,0,2
9,킬링타임용. 전 재밌게 봤구요. 너무 기대하면 재미없었을수도? 그래도 웃기려고 작정한 영화치곤 자연스러웠고 각 캐릭터가 확실해서 더 재밌고 연기가 자연스러워 더더 재밌었어요. :) 개인취향이 있는거니까 재미없었단 분...,2019.02.17 09:48,0,2
9,극장에서 맘껏 웃으면서 본 영화가 얼마만인지 정말 재밌게 잘 봤습니다!,2019.02.17 09:41,0,2
9,극한직업 너무 재밌었어요!,2019.02.16 21:59,0,2
9,진심 너무 웃기다 ㅎㅎㅎㅎ,2019.02.16 19:05,0,2
9,나 안 죽어 ㅋㅋ  고반장 고좀비 ㅋㅋㅋ,2019.02.16 11:59,0,2
9,"""이보다 더 웃길수는 없다""",2019.02.14 09:47,0,2
9,재밌어요. 다른 관객분들도 많이 웃으시고 맘 편히 선택할 수 있는 영화,2019.02.11 22:56,0,2
9,신파 없는 코메디가 선사하는 사이다 한 병,2019.02.10 23:02,0,2
9,너무나 재미있게 영화 잘 봤습니다,2019.02.10 14:36,0,2
9,그냥 재밌다는 말로밖에는 설명이 안될 영화!!!,2019.02.10 02:30,0,2
9,신하균님 역시 신하균이십니다. 류승룡님 진선규님은 각본 때문인지 캐릭터 때문인지 2%부족함을 느꼈습니다. 아쉽네요 ㅜ그래도 재밌게 잘 봤습니다.,2019.02.06 15:03,0,2
9,너무 재미있게보구 못처럼 많이 웃었어요^^,2019.02.06 10:52,0,2
9,탄탄한 스토리에 배우들의 자연스런 연기~ 간만에 실컷 웃었습니다~~,2019.02.06 10:35,0,2
9,"그냥 엄청 웃겼어요ㅋㅋ줄거리는 소재가 경찰, 마약이라 그런지 베테랑 코믹버전을 보는 것 같았어여",2019.02.06 10:31,0,2
9,"가까운 지인이나 가족과 부담없이 보고 즐길수 있는 영화로서 기억하고 싶다 , 모처럼 맘껏 웃고 힐링한 것 같아 좋았다",2019.02.06 10:30,0,2
9,마지막으로 갈수록 평이한 한국영화다운 전개가 다소 아쉽지만 그것만 빼면 10점드리고싶었던 정말 재밌고 웃기는 영화,2019.02.05 22:56,0,2
9,"너무 재미있고,웃겨요^^",2019.02.05 21:18,0,2
9,마지막까지 재밌었어요.,2019.02.05 08:22,0,2
9,가볍게 보기 좋았음!!!! 나름 스토리도 있고 계속 웃은 듯ㅋㅋㅋㅋ 가족끼리 보기 좋아요,2019.02.05 06:16,0,2
9,진짜 제가 좋아하는 유머코드만 다 모아뒀어요. 그냥 웃긴 영화에요  그냥 보면 겁나 현웃터지는 영화에요 신서유기에서 피오랑 민호랑 고요속의 외침했을때 처럼 웃겨요. 그냥 요즘 터지는 유머코드는 다때려박아서 전잼이에요...,2019.02.05 03:34,0,2
9,잘 만드셨네요  재미있어요,2019.02.05 01:31,0,2
9,ㅈㄴ 웃깁니다 그 표현이 전부에요 ㅋㅋㅋ마지막에 범인 잡고 가오잡고 있는 그들을 보며 웃겨서 울었음 ㅋㅋㅋㅋ,2019.02.05 00:58,0,2
9,오랜만에 엄청 재미있는 영화를 보고 왔어요^^ 영화 보는 내내 웃음이 끊이질 않아 행복했습니다!!,2019.02.04 20:07,0,2
9,아무 생각없이 힘빼고 편하게 볼 수 있는 그런 개그영화.힘든 요즘 가서 실컷 웃다가 오시길.류승룡님.진선규님은 그 와중에 정말...짱!!,2019.02.04 10:40,0,2
9,마지막까지시원한웃음ㅎㅎ,2019.02.04 09:01,0,2
9,하도 재밌다길래 예고편까지 챙겨보고 갔는데. 예고편 보지마라!! 웃음포인트 하나라도 놓치는게 너무 아쉽다!!,2019.02.04 06:44,0,2
9,완전 코미디 ㅜㅜ재미써요 !,2019.01.30 21:15,0,2
9,너무 웃겨요. 기대하지말고 편하게 보세요. 기대하고 보면 자꾸 평가를 하게되서 ㅋ,2019.01.30 01:17,0,2
9,연출이 좀 아쉬웠지만 그래도 감각이좋았다. 웃을수있다면 뭔들어떠하리,2019.01.29 02:30,0,2
9,웃긴데 약간 지루함배우들의 연기나 케미는 좋음,2019.01.28 02:49,0,2
9,가볍게 웃으며 볼 수 있는 영화,2019.01.28 01:32,0,2
9,오랜만에 만나는 빵빵 터트리는 영화. 약간 스토리가 미진한 것 빼면 나머지는 다 좋았음. 연기 쩔어. ㅋㅋㅋ,2019.01.28 01:29,0,2
9,볼만했습니다 영화보는내내 웃었네요,2019.01.26 23:53,0,2
9,존잼 ㄷㅐ유잼 영화 킬링타임생각하고 갔다가 두드려 맞고왔습니나,2019.01.26 09:33,0,2
9,아무 생각없이 웃고 나온 영화!!,2019.01.24 02:07,0,2
9,"마지막에 치고받는 액션씬이 조금 길어 지루했고, 나머지는 무난무난하게 편하게  웃으며 볼 수 있는 영화입니다!!",2019.01.23 13:52,0,2
9,정신 없이 웃다보니 끝나있었음.,2020.06.10 00:11,1,3
9,일단 하늬씨 촬영중 마지막 부둣가 격투씬에서 땅에 머리 부딪힌듯한데 괜찬은지?...소리가 너무 크게 들려서 깜짝 놀랬습니다...걱정되는군요.그리고 영화의 빠른 전개의 연출이 전체적으로 지루하지않아 너무 재미있게 봤습...,2020.05.05 01:49,1,3
9,잘 만든 코미디 영화 신기하게 캐릭터 겹치지 않고 악당까지도 다 눈에 잘 들어온다,2019.12.10 10:34,1,3
9,지금까지 이런 영화는 없었다 !류승룔 최고!!,2019.05.14 13:55,1,3
9,아무생각없이 즐겁게 볼만한 영화로 강추,2019.04.08 22:49,1,3
9,2시간 동안 웃다가 왔네요~,2019.03.25 12:34,1,3
9,드디어 이감독 유머가 빛을 발하는구나,2019.03.19 20:32,1,3
9,작품성은 그냥 그런데 개웃기다 ㅁㅊ ㅋㅋㅋ 평소에 코미디영화봐도 그냥 몇번 웃고말았는데 이건 개꿀잼 영화보고 남는건 웃음뿐이지만 그래도 그걸로도 충분할만큼 재밌어서 9점때림,2019.03.18 12:41,1,3
9,늘어짐 없는 개그코드 그리고 폭발하는 후반부. 이젠 한명의 믿고보는 배우인 진선규. 그리고 이하늬와 이동휘의 반전 매력이 돋보였다.,2019.03.18 09:53,1,3
9,재미있게 잘 봤어요 한없이 비굴하고 초라하다가도한순간 웃을수 있는 거사는게 그런거니까,2019.03.18 09:11,1,3
9,진짜 짱!! 팔순 넘으신 제 할아버지 할머니도 정말 즐겁게 보셨다네여 근데 이하늬분 욕하실때 살짝 어색... 평소 이미지와 정반대여서 그런듯요,2019.03.17 21:30,1,3
9,샤워 후에 마시는 캔맥주임. 답답함 없이 시원함.,2019.03.17 13:01,1,3
9,ㅋㅋ1600백만정도는  아닌데? 니가뭔데 그걸판단해ㅋㅋ 난 재밋게봣다ㅋㅋㄱ,2019.03.16 17:17,1,3
9,곳곳에 코믹요소가 억지스럽지않고 유쾌했어요~~진선균의 연기가 돋보이고~이하늬도 이쁜척않하고 제대로해서 좋아요^^인기있는 이유가 있었네요이런 유쾌한영화 많이 만들어주세요~,2019.03.16 14:44,1,3
9,감독이 류승룡의 캐릭터를 캐치를 잘해서 끌어올린 영화라고 보여진다.  근래에 재밋는 코미디물 . 장진 감독 스타일의 영화,2019.03.16 05:49,1,3
9,그냥 생각없이 보세요. 그냥 웃겨 드립니다^^ㅋ,2019.03.16 05:34,1,3
9,재밌게 잘 봤습니다. 류승룡씨 7급 공무원 때부터 팬이었습니다.,2019.03.15 08:17,1,3
9,재밌네.. 간만에 재밌는 영화봤다.,2019.03.15 00:48,1,3
9,재미지다 올만에 많이 웃었네요,2019.03.04 14:47,1,3
9,쏴~~ 여기서빵터짐ㅋㅋ,2019.03.03 23:35,1,3
9,부담없이 즐길수있는 잘만든 코미디영화.,2019.03.02 21:17,1,3
9,그냥  부담없이  웃을수 있는 영화다. 가끔  이런 영화가 필요하다. 고달프게 사는 현대인들에게는....,2019.03.02 06:38,1,3
9,재밌었지만 너무 웃길려는 개그때문에 1점뺍니당 ㅋㅋ,2019.02.22 12:58,1,3
9,가볍게 웃고 보기 좋은영화.,2019.02.22 10:41,1,3
9,최고의 킬링타임 영화 !!! 100분이 언제 지나갔는지 모르겠음 ^^,2019.02.22 10:31,1,3
9,일단 재밌었어요! 처음부터 마지막까지 지루하지 않고 깔깔 웃으면서 본 영화. 그치만 전 럭키가 더 재밋었는뎅...힝.. 아무튼 ㅋㅋㅋ 극한직업도 너무 재밌고 신선한 내용의 영화였습니다~ 꿀잼 인정b,2019.02.22 10:09,1,3
9,배우들 캐릭터 설정 및 캐미가 굳굳굳,2019.02.21 17:33,1,3
9,가볍게 보기 좋은 영화.,2019.02.20 20:18,1,3
9,너무 재미있게 봤네요~~이런 영화 좀 또 만들어주세요~,2019.02.20 11:14,1,3
9,"영화 구석구석 알면 재밌고 몰라도 괜찮은 요소들(황제치킨 등)도 재밌었고, 공기화되지 않는 캐릭터들도 좋았습니다. 나이대가 있는 분들도 고민없이 웃을수 있는 개그요소들까지 오랜만에 아깝지 않게 웃고 나온 영화였습니다...",2019.02.20 11:03,1,3
9,정말 느므느므 재밌어요 ~,2019.02.20 10:36,1,3
9,가볍게 볼려고 예매했는데 너무 재미있게 봤어요^^,2019.02.20 08:28,1,3
9,개인적인 생각으로는 역대 2위 영화까지는...이라는 생각이 들지만 최근 한국영화중에서 가장볼만했던건 사실이다 괜히 쓸대없는 신파 따위없이끝꺼지 스트레이트로 달리는 코미디..요즘 이런영화흔허지 않다..,2019.02.19 15:46,1,3
9,아무 생각없이 웃고 볼수 있는 영화네요. 단순 재미로는 1등. 확실한 오락영화.,2019.02.18 11:31,1,3
9,미친듯이 웃다 나올 수 있는 영화ㅋㅋㅋ재밌어요!!^^,2019.02.18 10:43,1,3
9,오랜만에 이렇게 웃어보는 영화는 처음이네요!!!,2019.02.18 00:51,1,3
9,아무생각없이 웃을 수 있는 영화,2019.02.18 00:37,1,3
9,유쾌하게 웃을수있는 재미있는 영화!,2019.02.16 13:37,1,3
9,그냥 별생각 없이 보고오면 참 재밌을 것 같은 영화,2019.02.16 09:21,1,3
9,완전 재밌었고 웃겻지만 스토리에 집중할수 없었느던게 아쉬웠당,2019.02.15 23:53,1,3
9,출연진들 다를 캐미가  짱   재밌어요 ㅋㅋㅋ,2019.02.15 16:03,1,3
9,저희 부모님이  보시고  왔는데 정말 재밌었다고 하십니다!!강추,2019.02.15 16:00,1,3
9,ㄹㅇ 내게맞는 코미디였음 ㅎㅎ,2019.02.15 15:43,1,3
9,가족끼리 부담없고 편하게 보기 좋은 오락영화입니다,2019.02.15 15:12,1,3
9,가족들과 함께  관람하기 좋은 영화인듯 해요웃고 보세요 잼나네요,2019.02.15 13:26,1,3
9,코미디계의 존 윅. 존 윅이 쉼 없이 싸운다면 극한직업은 쉼 없이 웃긴다.,2019.02.12 19:16,1,3
9,큰그림은 감독이그리고 80%는 진선규가 다해먹는구나 대단한 배우 감독의 배우들 캐스팅과 배우들의 맡은역활 정말 다들 열일한 영화,2019.02.12 15:06,1,3
9,신나게 웃고 즐길 수 있었다,2019.02.11 18:35,1,3
9,재밌다 다른말이 필요없다,2019.02.11 10:43,1,3
9,웃긴영화. 요즘웃긴영화 거의 안나오는데  만족합니다,2019.02.11 00:46,1,3
9,진짜웃기고 재밌음ㅋㅋ,2019.02.10 09:25,1,3
9,가볍게 가족들과 보기 좋아요,2019.02.09 16:25,1,3
9,"간만에 진짜 웃긴영화 봤네요~다른 배우들은 원래 검증된 분들이었고,저는 이영화를 '이하늬의 재발견'이라 부르고 싶어요",2019.02.09 12:13,1,3
9,우리가 어떤 민족인가?!?!빵빵 터트리는 민족 아닌가?!?,2019.02.08 20:54,1,3
9,재밌었어요 힐ㄹ;ㅇㅎㅎ,2019.02.08 20:41,1,3
